Name,Script,name_vi,name_en,script_vi,script_en
한국은 왜 대학진학률이 높을까? ,"한국에서 초등학교와 중학교는 의무교육으로 이루어지기 때문에 일부 특수목적 중학교를 제외하면 대부분 특별한 시험을 보지 않고 입학한다. 고등학교는 의무 교육에 해당되지는 않지만 거의 모든 학생들이 고등학교에 진학하고 있다. 한국에서 고등학교까지 마치는 학생들의 비율은 2014년 기준 98%로 OECD 국가 평균인 82%보다 높다. 한국의 고등학교 이수 비율이 높은 것은 대학 진학을 희망하는 학생들이 많다는 점과 관련이 깊다.
대학교에 입학하기 위해서는 일반적으로 대학수학능력시험(수능)을 치른다. 수능은 고등학교 졸업 예정자나 졸업자 및 이에 해당하는 학력을 가진 사람이면 누구나 볼 수 있고 매년 11월에 실시된다. 수능은 대학에서 공부할 수 있는 능력을 확인하는 시험으로, 대학 진학을 위해 치러야 하는 가장 중요한 시험이라고 할 수 있다. 수능 이외에도 각 대학에서 면접, 논술 등을 거친 후에 대학에 진학하게 된다. 한국의 대학 진학률은 경제협력 개발기구(OECD) 국가 중 최고 수준으로 2014년에는 약 70%에 달하였다.
한국에서 교육은 사회적 지위를 상승시킬 수 있는 중요한 방법 중 하나로 인식된다. 물론 가정 배경 등도 중요하지만, 학력은 취업과 임금에 많은 영향을 주고 있다. 실제로 고등학교 졸업자가 처음 받는 연봉을 100이라고 할 때 중학교 이하 졸업자가 71, 전문대 졸업자가 116, 대학교 이상 졸업자가 161로 집계되어 한국의 학력별 임금차이는 OECD 국가 중에서 가장 큰 것으로 나타났다. 대학을 나와야 사회적인 지위가 올라가고 취업, 결혼 등에 유리하다는 생각 때문에 좋은 대학에 가기 위한 경쟁이 치열하게 벌어지고, 많은 부모들이 비싼 등록금을 감당하면서도 자녀를 기꺼이 대학에 보내려고 한다. 이와 같은 이유로 한국의 대학 진학률은 다른 나라에 비해 매우 높게 나타난다고 할 수 있다.",Tại sao tỷ lệ vào đại học của Hàn Quốc cao?,Why is Korea having a high college entrance rate?,"Ở Hàn Quốc, tiểu học và trung học cơ sở là giáo dục bắt buộc nên ngoại trừ một bộ phận trường trung học cơ sở năng khiếu thì đại đa số các em học sinh nhập học mà không cần trải qua kì thi đặc biệt nào. Trung học phổ thông không phải là giáo dục bắt buộc nhưng hầu hết các em học sinh đều học lên cấp 3. Tỷ lệ các học sinh tốt nghiệp trung học phổ thông ở Hàn Quốc theo năm 2014 đạt 98%, cao hơn bình quân các nước OECD 82%. Việc tỷ lệ tốt nghiệp trung học phổ thông ở Hàn Quốc cao có mối liên quan sâu sắc với việc nhiều học sinh có mong mỏi học lên đại học.

Để nhập học đại học, bình thường phải trải qua kỳ thi tuyển sinh đại học. Kỳ thi tuyển sinh đại học được tổ chức vào tháng 11 hàng năm và bất cứ ai là người dự kiến tốt nghiệp (sắp tốt nghiệp) hoặc đã tốt nghiệp cấp 3 và những người có học lực tương đương đều có thể thi. Kỳ thi tuyển sinh đại học có thể nói là kỳ thi quan trọng nhất phải trải qua để học lên đại học, được coi như là kỳ thi kiểm tra năng lực có thể học đại học hay không. Ngoài thi tuyển sinh đại học thì ở mỗi trường đại học (các thí sinh) sau khi thông qua viết luận, phỏng vấn... mới được nhập học đại học. Tỷ lệ học lên đại học của Hàn Quốc đã đạt mức cao nhất trong số các quốc gia thuộc tổ chức hợp tác và phát triển kinh tế (OECD), khoảng 70% vào năm 2014.

Ở Hàn Quốc, giáo dục được coi là một trong những cách trọng yếu có thể nâng cao địa vị xã hội. Đương nhiên là nền tảng gia đình cũng quan trọng nhưng học vấn có thể ảnh hưởng lớn đến nghề nghiệp và tiền lương. Trên thực tế độ chênh lệch tiền lương theo học vấn ở Hàn Quốc là cao nhất trong số các quốc gia OECD, được thống kê rằng nếu lương một năm người tốt nghiệp cấp 3 nhận lần đầu là 100 thì người tốt nghiệp cấp 2 trở xuống là 71, người tốt nghiệp cao đăng nghề là 116, người tốt nghiệp đại học trở lên là 161. Vì có suy nghĩ phải tốt nghiệp đại học để nâng cao địa vị xã hội và có lợi cho tìm việc, hôn nhân nên cuộc cạnh tranh để vào trường đại học tốt diễn ra rất khốc liệt, nhiều phụ huynh trong khi phải cán đáng mức học phí đắt đỏ nhưng vẫn sẵn lòng gửi con vào đại học. Chính vì lý do này mà có thể cho rằng tỷ lệ học lên đại học của Hàn Quốc là rất cao so với các quốc gia khác.","In Korea, elementary and junior high schools are compulsory, so most students, except for some special-purpose middle schools, are admitted without taking special tests. High school is not a compulsory education, but almost all students go to high school. The proportion of students who finish high school in Korea is 98% in 2014, which is higher than the OECD average of 82%. The high rate of high school completion in Korea has a lot to do with the fact that there are many students who want to go to college.
In order to enter a university, you usually take the University Scholastic Ability Test (SAT). The college entrance exam is open to high school graduates or anyone who has the same academic background and is held every November. SAT is a test that confirms your ability to study at a university, and it can be said that it is the most important test you need to take to go to college. In addition to college entrance exams, students go to college after interviews and essay writing at each college. Korea's university enrollment rate is the highest among OECD countries (OECD), reaching around 70% in 2014.
In Korea, education is recognized as one of the important ways to increase social status. Of course, the background of the family is also important, but education has a great influence on employment and wages. In fact, when the annual salary that a high school graduate receives for the first time is 100, the number of graduates under junior high school is 71, that of junior college graduates is 116, and that of 161 graduates is higher than that in Korea. The idea that social status rises when you leave college and that you have a good job, marriage, and so on, is that the competition to go to a good college is fierce, and many parents are willing to send their children to college while paying a high tuition fee. For this reason, it can be said that the rate of college admission in Korea is much higher than in other countries."
한국에서인기있는합격기원선물,"한국에서는 수능이나 입사 시험 등과 같이 중요한 시험을 보는 사람들에게 시험을 잘 보라는 의미로 여러 가지 선물을 한다. 엿과 찹쌀떡은 잘 붙고 쉽게 떨어지지 않기 때문에 옛날부터 합격을 기원하는 선물로 많이 주고 받았다. 요즘에는 잘 찍으라는 의미의 포크, 잘 풀라는 의미의 휴지, 시험을 잘 보라는 의미의 거울 등도 선물한다.",Những món quà chúc thi đỗ phổ biến ở Hàn Quốc.,Popular gift for passing an examination,"Ở Hàn Quốc, người ta tặng nhiều loại quà mang ý nghĩa chúc thi tốt cho những người tham gia các kỳ thi quan trọng như là thi tuyển sinh đại học hoặc thi tuyển vào công ty. Vì kẹo kéo và bánh bột nếp dính tốt và không dễ bị rớt nên từ xưa đã thường được tặng như là món quà chúc thi đậu. Ngày nay, mọi người cũng tặng các món quà như là tặng nĩa được cho là mang ý nghĩa chọn đúng đáp án, giấy vệ sinh mang ý nghĩa giải bài tốt, gương mang ý nghĩa thi tốt.","In Korea, various gifts are given to those who take important tests, such as entrance exams or entrance exams, to take the test well. Since rice cake and glutinous rice cake stick well and don't fall off easily, I gave and received many gifts as a wish to pass. Nowadays, we also present a fork, which means to take good photos, a tissue, which means to solve well, and a mirror to take a good test."
기러기 아빠 왜 생겼을까? ,"한국은 대학 진학률뿐 아니라 교육열도 세계 최고 수준으로 높다. 한국의 높은 교육 열은 우수한 인재를 많이 길러내는 데 크게 이바지했고, 궁극적으로 한국 경제가 짧은 기간에 빠르게 발전할 수 있도록 많은 영향을 끼친 것으로 평가되고 있다.
하지만 지나친 교육열로 인해 몇 가지 문제점도 나타나고 있다. 한국의 높은 교육 열은 대부분 대학 진학을 위한 것이다. 좋은 대학에 진학하는 것이 사회적으로 성공하기 위한 기본 조건이라고 생각하는 많은 부모들이 특히 자녀의 중·고등학교 시기에 사교육비로 적지 않은 돈을 쓴다. 정규 학교교육만 받을 경우에는 그리 큰 돈이 들지 않지만, 학원이나 과외 등 사교육을 받으려면 많은 돈이 필요하기 때문에 부모들에게 상당한 부담을 주고 있다.
사교육은 부모뿐 아니라 학생들에게도 부담을 준다. 많은 학생들이 좋은 대학에 가기 위해 밤늦게까지 학원에서 공부하거나 인터넷 강의를 듣는 경우가 많다. 특히 대학 입시를 앞둔 고등학교 3학년 학생의 생활은 더욱 힘들다. 그래서 ‘고3병’, ‘입시지옥’과 같이 힘든 고등학교 생활을 표현하는 말도 생겨났다. 최근에는 과학 고나 외국어고 등과 같은 특수목적 고등학교가 좋은 대학 진학에 유리하다고 인식 되면서 대학 입시뿐 아니라 일부 고등학교의 입학 경쟁도 치열해지고 그에 따라 입시 스트레스에 시달리는 연령도 더 낮아지고 있다.
한편, 대학 진학과 취업에 영어 실력이 큰 영향을 끼치는 경우가 적지 않아서 영어 교육에 대한 관심도 높다. 그래서 자녀가 어릴 때부터 영어를 쓰는 나라로 조기 유학을 보내기도 한다. 이때 어린 자녀만 외국에 혼자 보낼 수 없기 때문에 아이의 엄마가 같이 가게 되고, 아빠는 한국에 남아서 돈을 벌어 학비를 보내는 경우가 많다. 이러한 상황에 있는 아빠를 기러기 아빠라고 한다. 1990년대 말 조기유학 열풍으로 시작된 기러기 아빠의 증가는 가족 관계에도 좋지 않은 영향을 줄 수 있기 때문에 사회적으로 문제가 되기도 한다.","Tại sao xuất hiện ""bố ngỗng""?","Why does the ""geese dad"" appear?","Hàn Quốc không chỉ tỷ lệ học lên đại học mà nhiệt huyết giáo dục cũng ở mức cao nhất thế giới. Nhiệt huyết giáo dục cao ở Hàn Quốc đã góp phần rất lớn trong việc đào tạo ra nhiều nhân tài ưu tú, cuối cùng, nó được đánh giá là thứ có ảnh hưởng lớn để nền kinh tế Hàn Quốc có thể phát triển nhanh chóng trong một thời gian ngắn.

Tuy nhiên, cũng bởi tại nhiệt huyết giáo dục quá mức mà nhiều vấn đề đã và đang nảy sinh. Nhiệt huyết giáo dục cao đại đa phần là dành cho việc học lên đại học. Đặc biệt nhiều bậc phụ huynh có suy nghĩ rằng việc vào được các trường đại học tốt là điều kiện cơ bản cho sự thành công trong xã hội, đã chi không ít cho tiền học thêm của con cái trong thời gian học cấp 2 và cấp 3. Không cần phải tốn nhiều tiền như thế trong trường hợp chỉ học chính quy ở trường, nhưng vì cần nhiều tiền để được học tư như học viện hay học thêm nên đã gây ra gánh nặng tương đối cho phụ huynh.

Học thêm không chỉ gây gánh nặng cho phụ huynh mà còn cả với các em học sinh. Rất nhiều trường hợp các em học sinh phải học tại học viện hoặc nghe giảng qua mạng đến tận đêm khuya để vào được trường đại học tốt. Đặc biệt cuộc sống của các em học sinh đứng trước ngưỡng cửa thi đại học lại càng mệt mỏi. Vì vậy nên cũng đã xuất hiện các câu nói thể hiện cuộc sống năm học cấp 3 khổ sở như là ""bệnh học sinh năm 3"", ""địa ngục trần gian thi tuyển sinh"". Gần đây, khi được nhận thức rằng các trường trung học phổ thông năng khiếu như trường cấp 3 khoa học hay trường cấp 3 ngoại ngữ có lợi cho việc vào được trường đại học tốt, thì không chỉ kỳ thi tuyển sinh đại học mà sự cạnh tranh vào trường cấp 3 cũng trở nên khốc liệt và kéo theo đó là độ tuổi phải vật vã vì áp lực thi cử cũng đang ngày càng thấp đi.

Ngoài ra, các trường hợp mà năng lực tiếng Anh có ảnh hưởng lớn đến việc vào đại học và xin việc là không hề ít nên sự quan tâm dành cho việc học tiếng Anh cũng cao. Vì vậy con cái cũng được gởi đi du học từ sớm đến những quốc gia sử dụng tiếng Anh ngay từ khi còn nhỏ. Lúc này, vì không thể gởi con còn nhỏ một mình ở nước ngoài nên nhiều trường hợp mẹ của đứa trẻ phải đi theo cùng, người bố ở lại Hàn Quốc kiếm tiền gởi học phí. Người bố ở trong trường hợp như thế này gọi là ""bố ngỗng"". Với cơn sốt du học sớm vào cuối thập niên 1990 đã bắt đầu sự gia tăng của những ""ông bố ngỗng"" vì có thể gây ảnh hưởng không tốt đến quan hệ gia đình nên cũng trở thành vấn đề xã hội.","Korea has not only the highest college entrance rate in the world but also an enthusiasm for education. Korea's high education enthusiasm has greatly contributed to the development of excellent talents, and ultimately, it is considered to have had a great influence on the Korean economy to develop rapidly in a short period of time.
However, there are some problems due to excessive education fever. Most of Korea's high education enthusiasm is for college. Many parents who think that going to a good college is a basic condition for social success, spend a lot of money on private education, especially during their children's middle and high school years. It doesn't cost much money to get regular school education, but it takes a lot of money for parents because it takes a lot of money to get a private education such as academy or private tutoring.
Private education puts a burden on students as well as parents. Many students often study at an academy or take an internet lecture late at night to get to a good university. In particular, the life of a high school third-grade student who is about to enter university is more difficult. So, words like'high 3 bottles' and'admission hell' also appeared to express a difficult high school life. In recent years, special high schools, such as science high schools and foreign language high schools, have been recognized as being advantageous for entering a good university, and competition for admission to some high schools as well as college entrance exams is fierce, and the age under which the students are subjected to entrance exam stress is getting lower.
On the other hand, there are very few cases where English proficiency has a great influence on college entrance and employment, and interest in English education is also high. As a result, children often go abroad to study English at an early age. At this time, since only a small child cannot be sent to a foreign country alone, the mother of the child goes with him, and the father often stays in Korea to make money and send tuition. The father in this situation is called the geese father. The increase of geese dads, which began as a craze for studying abroad in the late 1990s, is also a social problem because it can have a negative effect on family relationships."
이주민가족자녀를위한특별전형제도,"대학에서 학생을 선발하는 방법에는 일반 학생들을 대상으로 하는 일반 전형과 특별한 자격이 있는 학생을 대상으로 하는 특별 전형이 있다. 특별 전형 대상에는 농어촌학생, 재외국민, 특성화고교출신자, 저소득층학생 등이 있고, 이주민 가족의 자녀도 여기에 포함된다. 이주민 가족 자녀를 위한 특별 전형은 2011년 대학입시 무렵에 처음 실시되었는데 예를 들어, 일부 대학에서 ‘고른기회전형’, ‘한마음 무궁화 특별전형’ 등과 같은 명칭으로 학업 기회를 제공한 바 있다.",Chế độ xét tuyển đặc biệt dành cho con em gia đình nhập cư,Special Admission System for Children of Migrant Families,"Phương pháp xét tuyển học sinh vào đại học có xét tuyển thường dành cho đối tượng là học sinh bình thường và xét tuyển đặc biệt dành cho đối tượng là học sinh có tư cách đặc biệt. Đối tượng xét tuyển đặc biệt có học sinh vùng nông thôn và làng chài, kiều bào sinh, người có xuất thân học trường chuyên cấp 3, học sinh nghèo, con em trong gia đình người nhập cư cũng được bao gồm ở đây. Xét tuyển đặc biệt dành cho con em gia đình người nhập cư được thực thi lần đầu tiên vào kỳ thi tuyển sinh đại học năm 2011, mang đến cơ hội học tập ở một bộ phận trường đại học với những tên gọi ví dụ như là ""xét tuyển cơ hội đồng đều"" (고른기회전형), ""xét tuyển đặc biệt Mukunghoa một tấm lòng"" (한마음 무궁화 특별전형).","The methods for selecting students in college are general admissions for general students and special admissions for students with special qualifications. Special admissions targets include rural and rural students, overseas Koreans, specialized high school students, and low-income students, including children of migrant families. Special admissions for immigrant families' children were first conducted at the time of college admission in 2011. For example, some universities offered academic opportunities under the same names as “Earth-wheeling” and “Special admission for one-hearted Mugunghwa”."