Name,Script,name_vi,name_en,script_vi,script_en
재산과 관련된 문제는 어떻게 해결해야 할까? ,"다른 사람들과 중요한 약속을 하거나 거래를 할 때 법을 잘 알지 못하여 어려움을 겪는 경우가 생길 수 있다. 그러한 상황에서 피해를 입지 않고 자신의 정당한 권리를 행사하기 위해서는 혹시 문제가 생겼을 때 법의 도움을 받을 수 있도록 여러 가지 방법을 미리 알아 두어야 한다.

다른 사람과 돈을 주고받는 거래를 할 때는 계약서를 작성하는 것이 좋다. 계약서는 나와 상대방이 약속한 사실을 확인해 주는 문서이다. 다른 사람에게 돈을 빌려 주거나 빌릴 때 작성하는 차용증도 계약서에 해당한다. 차용증에는 돈을 빌리는 사람과 빌려주는 사람의 이름과 서명, 빌린 돈의 액수, 이자, 돈을 갚을 날짜 등이 기록된다.

집이나 땅, 건물 등과 같은 부동산 계약을 할 때도 여러 가지 서류를 꼼꼼하게 살펴보고 확인해야 한다. 특히 계약서와 함께 해당 부동산의 등기부등본을 반드시 확인하고 계약하는 사람이 실제 집주인이 맞는지, 해당 부동산에 다른 법적인 문제가 없는지를 자세히 확인해야 한다. 일정 기간 동안 집이나 건물을 빌려 쓰는 경우도 많은데, 그 경우에 집이나 건물을 빌리는 사람을 보호하기 위한 여러 가지 제도가 마련되어 있으므로 이를 잘 활용하는 것이 중요하다.

외국인이 한국에서 생활하면서 여러 가지 계약을 맺을 때에는 법무사나 변호사 등 법률전문가의 도움을 받는 것이 좋다. 법무사는 법원이나 검찰 등에 내야 하는 서류를 대신해서 작성해 준다. 변호사는 재산 문제에 관한 재판을 할 때 상담 및 변호 등과 같은 도움을 줄 수 있다. 특히 부동산과 관련된 계약을 할 때에는 공인 중개사를 통하면 비교적 안전하게 거래할 수 있다.",Vấn đề liên quan đến tài sản phải giải quyết thế nào?,How do we deal with property problems?,"Sẽ có những trường hợp gặp phải khó khăn không biết rõ luật khi thực hiện giao ước hay một giao dịch quan trọng với người khác. Để không bị thiệt hại và thực hiện được quyền lợi chính đáng của mình trong các tình huống, bạn phải nắm rõ trước các cách thức để có thể nhận được trợ giúp về luật khi lỡ có phát sinh vấn đề.

Khi thực hiện giao dịch trao đổi tiền bạc với người khác, bạn nên làm hợp đồng. Hợp đồng là tài liệu xác nhận thực tế giao ước giữa tôi và đối phương. Giấyvay nợ được viết khi vay mượn hoặc cho người khác vay mượn cũng thuộc là một hợp đồng. Trong chứng từ vay mượn có ghi tên và chữ ký của người vay tiền và người cho vay, số tiền vay, tiền lãi, ngày sẽ trả...

Khi thực hiện ký hợp đồng bất động sản như là tòa nhà, nhà hoặc đất, bạn phải xem xét và kiểm tra kỹ lưỡng các loại giấy tờ. Đặc biệt, nhất định phải kiểm tra hợp đồng với bản sao công chứng giấy đăng ký bất động sản đó và phải kiểm tra một cách tỉ mỉ xem người ký hợp đồng có đúng là chủ nhà thực tế không, có vấn đề pháp lý gì khác đối với bất động sản đó không... Cũng có nhiều trường hợp thuê sử dụng nhà hoặc tòa nhà trong một thời gian nhất định, trong trường hợp đó có nhiều chế độ được soạn thảo để bảo vệ quyền lợi của người thuê nhà hoặc tòa nhà, nên điều quan trọng là bạn cần tận dụng nó cho tốt.

Người nước ngoài trong lúc sinh sống tại Hàn Quốc, khi ký các loại hợp đồng tốt hơn hết là nhận được sự giúp đỡ từ các chuyên gia luật như là chuyên viên tư vấn luật hoặc luật sư. Chuyên viên tư vấn luật sẽ đại điện thay để soạn thảo hồ sơ giấy tờ trình lên tòa án hay cơ quan kiểm sát. Luật sư thì có thể giúp đỡ các vấn đề như tư vấn và bào chữa khi tiến hành xét xử liên quan đến vấn đề tài sản. Đặc biệt là khi ký kết hợp đồng liên quan đến bất động sản nếu thông qua 공인 중개사 (nhà mô giới được công nhận tư cách pháp lý), bạn có thể thực hiện giao dịch tương đối an toàn.","When making important appointments or dealings with others, you may encounter difficulties because you are not familiar with the law. In order to exercise your legitimate rights without being harmed in such a situation, you need to know in advance a number of ways to get help from the law in case of trouble.

It's a good idea to write a contract when you're dealing with someone else. The contract is a document confirming the fact that the other party and I have promised. Borrowing or borrowing loans to other people is also a contract. The borrower's name and name of the borrower and the borrower's name and signature, the amount of money borrowed, interest, and the date to pay the money are recorded.

When you sign a real estate contract, such as a house, land, or building, you must carefully check and check various documents. In particular, you must check the certified copy of the real estate along with the contract, and check in detail whether the person who is contracting is the real landlord and that there are no other legal issues in the real estate. In many cases, a house or a building is rented for a certain period of time, and in that case, it is important to use it well because there are various systems to protect the person who rents the house or building.

When foreigners live in Korea and make various contracts, it is good to get help from law experts such as lawyers and lawyers. The lawyer will fill out the documents you have to submit to the court or the prosecution. Attorneys can help with counseling and lawyers in courts on property matters. In particular, when making a contract related to real estate, you can trade relatively safely through an authorized broker."
집을 빌리는 사람을 보호하기 위한 주택임대차 보호법,다른 사람이 소유한 집에 전세나 월세로 사는 사람을 보호하는 법을 ‘주택임대차 보호법’이라고 한다. 임대차 계약은 보통 2년을 기간으로 한다. 계약 기간이 끝나기 한 달 전까지 집주인(임대인)과 세 들어 사는 사람(임차인)이 그 계약을 종료하겠다는 의사를 표현하지 않으면 계약은 자동으로 연장되어 2년 더 효력을 가진다. 계약 기간이 모두 지났는데도 집주인이 보증금을 돌려주지 않으면 세 들어 사는 사람은 보증금을 돌려받을 때까지 집에서 나가지 않아도 된다. 외국인도 체류지 변경신고를 하고 확정일자를 받아두면 주택임대차 보호법에 따른 보호를 받을 수 있다.,"""Đạo luật bảo vệ cho thuê nhà"" (주택임대차 보호법) để bảo vệ những người thuê nhà.",Housing Lease Protection Act to Protect People Renting a House,"Luật bảo vệ những người đang sinh sống trong ngôi nhà thuộc sở hữu của người khác theo hình thức thuê theo tháng (월세) hoặc thuê kiểu kí gởi (전세) được gọi là 주택임대차 보호법. Hợp đồng thuê thường có thời hạn 2 năm. Nếu đến 1 tháng trước khi chấm dứt hợp đồng, chủ nhà (임대인) và người thuê nhà (임차인) không thể hiện ý định chấm dứt hợp đồng thì hợp đồng sẽ được tự động gia hạn và có hiệu lực thêm 2 năm. Nếu chủ nhà chưa trả lại tiền đặt cọc dù đã quá thời hạn hợp đồng, thì người thuê nhà có quyền không rời khỏi nhà cho đến khi nhận lại được tiền cọc. Người nước ngoài cũng có thể được bảo vệ theo luật bảo vệ cho thuê nhà nếu đã có khai báo thay đổi địa chỉ cư trú và được xác nhận giấy 확정일자 (giấy xác nhận ngày)","The law that protects people who live on a rented or rented house owned by someone else is called the “Housing Rental Protection Act”. Lease contracts usually have a period of two years. If the landlord (tenant) and the tenant (tenant) do not express their intention to terminate the contract one month before the end of the contract period, the contract is automatically extended for two more years. If the landlord does not return the deposit even after the contract is over, the renter does not have to leave the house until the deposit is returned. Foreigners can also receive protection under the Housing Lease Protection Act by filing a change of residence and receiving a fixed date."
가족과 관련된 문제는 어떻게 해결해야 할까? ,"오늘날에는 가족이나 친족 사이에서도 많은 분쟁이 발생하고 있다. 그러한 문제를 모두 가족이나 친족 간의 대화나 결정만을 통해서 해결하기는 어렵다. 그러한 분쟁을 보다 합리적으로 해결하기 위해 한국에서는 미리 법에서 가족과 관련된 여러 가지 내용을 규정하고 있다.

먼저, 한국에서 결혼을 하기 위해서는 만 18세 이상이 되어야 하고, 그보다 어린 경우에는 반드시 부모의 동의를 얻어야 한다. 그리고 두 사람이 정식으로 부부로 인정받기 위해서는 시청, 구청, 군청 등에 혼인신고를 해야 한다. 혼인신고를 하지 않은 경우에는 법의 보호를 받지 못하는 경우가 생길 수 있다.

결혼을 하게 되면 부부는 서로에 대해 여러 가지의무를 지게 된다. 예를 들어, 부부는 특별한 이유없이 함께 사는 것을 거부할 수 없다. 또한 부부는 정신적, 육체적, 경제적으로 서로 돕고 의지하며 생활해야 한다. 일반적으로 남편이나 아내가 직장, 가게 등에서 벌어들인 돈으로 생활하는데, 법적으로는 가정주부가 집안에서 하는 요리, 청소 등과 같은 가사노동도 생활비를 벌어온 것으로 인정된다.

부부로서의 관계를 끊고 싶을 때에는 합의나 재판에 의해 이혼을 할 수 있다. 만약 양측이 모두 이혼을 원하면 가정법원의 확인을 받아서 이혼할 수 있다. 하지만 합의가 없더라도 상대방이 부정한 행위를 하는 등 배우자로서의 의무를 제대로 이행하지 않고 상대방을 고통스럽게 한 경우에는 법원의 판결을 통해 강제로 이혼 할 수도 있다. 이혼을 하는데 원인을 제공하고 잘못이 있는 배우자는 상대방에게 위자료를 지급해야 한다.",Vấn đề liên quan đến gia đình phải giải quyết thế nào?,How do you solve family problems?,"Ngày nay có nhiều tranh chấp xảy ra trong mối quan hệ gia đình hoặc họ hàng. Tất cả những vấn đề như thế này thì khó mà giải quyết nếu chỉ thông qua đối thoại hoặc quyết định giữa gia đình hoặc họ hàng với nhau. Để giải quyết các tranh chấp đó một cách hợp lý hơn, Hàn Quốc đã quy định sẳn trong luật các nội dung liên quan đến gia đình.

Đầu tiên, để kết hôn ở Hàn Quốc, chỉ 18 tuổi trở lên mới được phép và nếu nhỏ tuổi hơn, bạn phải có được sự đồng ý của cha mẹ. Và để hai người được công nhận là vợ chồng chính thức, phải làm đăng ký kết hôn ở ủy ban thành phố, ủy ban quận, ủy ban huyện... Trong trường hợp không làm đăng ký kết hôn, sẽ có thể nảy sinh hình huống bạn không được bảo vệ bởi pháp luật.

Khi đã kết hôn, các cặp vợ chồng phải có nhiều nghĩa vụ đối với nhau. Ví dụ như là, vợ chồng không thể từ chối chung sống với nhau mà không có lý do đặc biệt.  Ngoài ra vợ chồng phải chung sống và hỗ trợ nhau về mặt tinh thần, thể chất, kinh tế. Thông thường, chúng ta sinh sống bằng tiền do chồng hoặc vợ kiếm được ở nơi làm việc hoặc cửa hàng..., nhưng theo pháp lý, các công việc nhà như là nấu ăn, dọn dẹp do người nội trợ làm ở nhà cũng được công nhận là công việc kiếm sống.

Khi muốn chấm dứt quan hệ vợ chồng, có thể ly hôn theo thỏa thuận hoặc xét xử. Nếu cả hai bên đều muốn ly hôn, họ có thể ly hôn với sự xác nhận của tòa án gia đình. Tuy nhiên trong trường hợp vợ hoặc chồng không thực hiện đúng nghĩa vụ và gây ra đau khổ cho đối phương chẳng hạn như là đối phương có hành vi ngoại tình thì dù không có sự đồng thuận cũng có thể ly hôn bằng cưỡng chế thông quan xét xử của tòa án. Ly hôn phải đưa ra lý do và người vợ hoặc chồng có lỗi phải chi trả tiền bồi thường cho đối phương.","Today, there are many conflicts between family members and relatives. It is difficult to solve all such problems only through dialogue or decision between family and relatives. In order to settle such disputes more reasonably, the Korean law prescribes various matters related to families.

First, in order to get married in Korea, you must be 18 years of age or older, and if you are younger, you must obtain parental consent. In addition, in order for the two of them to be formally recognized as a couple, a marriage report must be made to the city hall, ward office, or county office. If you do not file a marriage report, you may not be protected by the law.

When married, couples have many obligations to each other. For example, couples cannot refuse to live together for no particular reason. In addition, the couple must live each other mentally, physically, and economically to help each other. In general, husbands and wives live with money earned from work, shops, etc. It is legally recognized that housewives, such as cooking and cleaning in the house, have earned living expenses.

When you want to end your relationship as a couple, you can divorce by agreement or trial. If both sides want a divorce, they can get a divorce with confirmation from the Family Court. However, even if there is no agreement, if the other party does not properly fulfill his/her duties as a spouse, etc., and suffers the other party, he or she may be forcibly divorced through a court decision. The cause of the divorce, and the spouse who is wrong must pay alimony to the other."