Name,Script,name_vi,name_en,script_vi,script_en
소송을 통해 어떻게 권리를 보호받을 수 있을까? ,"외국인이 한국에서 살아가면서 다른 사람들과 분쟁을 겪는 일이 발생할 수 있다. 분쟁이 잘 해결되지 않을 경우에 법의 도움을 받아서 보다 공정하게 해결하고 자신의 권리를 보호받을 수 있다.

법을 통해 권리를 보장받는 대표적인 방법은 소송 이다. 소송은 법원의 재판을 통해 분쟁을 해결하는 방식이다. 개인들 간의 재산 문제나 가족 문제로 분쟁이 발생한 경우 분쟁의 당사자는 소송을 통해 법원의 판결을 요청할 수 있다. 또한, 국가의 행위로

인해 직접적인 피해를 입거나 세금 등을 과도하게 납부하게 되었을 때에는 피해 당사자가 국가를 상대로 소송을 제기할 수 있다. 소송이 제기되면 법원의 판사는 당사자들의 주장을 듣고 법률에 따라 판결을 내려 분쟁을 해결한다.
일반적으로 소송 과정에서는 변호사와 같은 법률전문가의 도움을 받는 경우가 많다. 하지만 비용 등의 문제로 변호사를 구하는데 어려움이 있다면 대한법률구조 공단과 같은 공익적인 기구 등을 통해서도 법적 도움을 받을 수 있다.

물론, 모든 분쟁을 재판으로 해결하는 것이 최선은 아닐 수 있다. 왜냐하면 재판을통한 해결은 많은 시간과 비용을 필요로 하고, 재판에 참여하는 당사자들에게 고통을 줄수도있기때문이다.따라서가급적재판까지가지않고당사자간의대화 타협으로 원만하게 문제를 해결하려고 노력하는 것이 바람직하다.",Có thể nhận được sự bảo vệ quyền lợi như thế nào thông qua kiện tụng?,How can rights be protected through litigation?,"Người ngoại quốc trong quá trình sinh sống tại Hàn Quốc thì việc tranh chấp quyền lợi với người khác là có thể xảy ra. Trong trường hợp tranh chấp không giải quyết được, bạn có thể nhận được sự giúp đỡ từ luật pháp để có thể giải quyết một cách công bằng và bảo vệ được quyền lợi của bản thân.

Một cách điển hình để đảm bảo được quyền lợi thông qua pháp luật chính là kiện tụng. Kiện tụng là phương thức giải quyết tranh chấp thông qua xét xử tại tòa án. Nếu phát sinh tranh chấp do vấn đề gia đình hay vấn đề tài sản giữa các cá nhân, các bên liên quan đến tranh chấp có thể nộp đơn yêu cầu sự phán quyết của tòa án thông qua tố tụng. Ngoài ra trong trường hợp nếu hành vi của nhà nước gây ra thiệt hại trực tiếp hoặc bắt đóng tiền vượt mức ví dụ như thuế thì bên bị hại có thể khởi kiện nhà nước. Khi một vụ kiện được đệ trình, thẩm phán của tòa án sẽ lắng nghe chủ trương của các bên liên quan và đưa ra phán quyết theo quy định của pháp luật để giải quyết tranh chấp.

Thông thường, trong quá trình tố tụng, thường nhận được sự giúp đỡ của các chuyên gia luật như là luật sư. Tuy nhiên, giả sử nếu gặp khó khăn trong việc tìm luật sự do vấn đề như là chi phí, bạn cũng có thể nhận được sự giúp đỡ về mặt pháp luật thông qua các tổ chức công ích như là Cơ quan hỗ trợ pháp lý Hàn Quốc (대한법률구조공단). 

Tất nhiên, giải quyết bằng xét xử tranh chấp có thể không phải là cách tối ưu trong mọi trường hợp. Bởi vì việc giải quyết thông qua xét xử cần nhiều chi phí và thời gian, và việc tham gia vào xét xử có thể gây ra mệt mỏi cho các bên đương sự. Do đó, nếu có thể thì đừng đưa ra xét xử và cố gắng giải quyết vấn đề một cách thân tình bằng cách đối thoại và thỏa hiệp giữa các bên sẽ hợp lý hơn.","As foreigners live in Korea, it can happen that they have a conflict with others. If the dispute is not well resolved, with the help of the law, you can settle it more fairly and protect your rights.

Litigation is a typical way to secure rights through law. Lawsuits are a way of resolving disputes through court trials. In the event of a dispute due to property or family problems between individuals, the parties to the dispute may request a court ruling by litigation. Also, as a national act

In the event of direct damage or excessive tax payment, the affected party may sue the country. When a lawsuit is filed, the court judge hears the claims of the parties and decides according to the law to settle the dispute.
In general, lawyers often get help from lawyers, such as lawyers. However, if it is difficult to find an attorney due to problems such as cost, legal aid can also be obtained through public interest organizations such as the Korea Legal Aid Corporation.

Of course, it may not be the best to settle all disputes by trial. This is because the solution through trial takes a lot of time and money, and it can cause pain to the parties participating in the trial. desirable."
대한법률구조공단 이용하기,"대한법률구조공단은 경제적으로 어렵거나 법을 모르기 때문에 법의 보호를 제대로 받지 못하는 사람들이 적법한 절차에 의하여 정당한 권리를 보호받을 수 있도록 하기 위한 기관이다.

법률이나 소송관련 상담은 누구나 무료로 받을 수 있으며, 나아가 한국어에 서툴러 소송에 어려움을 겪고 있는 외국인이라면 민사나 형사 등의 사건소송 대리까지도 도움 받을 수 있다.

공단의 법률 구조를 받기 위해서는 우선 공단사무실을 방문하여 상담을 받아야 하는데, 이때 자신이 가지고 있는 관련 서류를 모두 가지고 오는 것이 좋다. 직접 방문이 어려운 경우라면 홈페이지를 통해 사이버상담을 받을 수도 있다.",Sử dụng Cơ quan hỗ trợ pháp lý Hàn Quốc,Using the Korea Legal Aid Corporation,"대한법률구조공단 là cơ quan hoạt động để những người không nhận được sự bảo vệ theo đúng luật pháp do khó khăn về mặt kinh tế hay không hiểu luật có thể được bảo vệ quyền lợi chính đáng theo một trình tự hợp pháp. 

Bất kỳ ai đều có thể nhận được sự tư vấn liên quan đến luật pháp hay tố tụng một cách miễn phí, nếu là người nước ngoài không thạo tiếng Hàn, đang gặp khó khăn trong việc kiện tụng, bạn có thể nhận được giúp đỡ đến cả việc giúp xử lý hộ các vụ kiện dân sự hay hình sự...

Để nhận được sự hỗ trợ pháp lý của cơ quan, trước tiên bạn phải đến văn phòng của cơ quan để được tư vấn, lúc này tốt nhất hãy mang hết tất cả những tài liệu liên quan bạn đang có đến. Nếu gặp khó khăn trong việc đến trực tiếp, bạn có thể nhận được sự tư vấn trực tuyến thông qua trang web.","The Korea Legal Aid Agency is an organization that enables people who are not properly protected by the law because they are economically difficult or do not know the law to have their rights protected by legitimate procedures.

Anyone who has legal or litigation-related counseling can receive it free of charge, and even foreigners who are struggling in Korean with difficulties in litigation can also assist with lawsuits in civil and criminal cases.

In order to receive the legal structure of the Corporation, it is necessary to first visit the Corporation office for consultation, and it is good to bring all relevant documents. If it is difficult to visit in person, you can also receive cyber consultation through the website."
권리 보호를 위해 도움을 주는 기관은 어디일까? ,"한국은 민주주의 국가로서 국민의 권리를 보호하기 위해 여러 제도를 만들어 두고 있다. 따라서 각 개인은 자신의 권리뿐만 아니라 타인의 권리를 보호하기 위해 이러한 제도를 잘 이해하고 적극적으로 활용할 필요가 있다.

국가인권위원회는 모든 사람들이 갖는 기본적인 인권을 보호하기 위한 국가기관 이다. 국가기관이나 회사 또는 다른 사람 등에 의해 차별을 받았거나 부당한 대우 등의 인권침해를 당한 사람은 국가인권위원회에 상담, 조사, 구제 등을 요청하여 도움을 받을 수 있다. 인권 침해 사실이 있다고 판단될 경우 국가인권위원회는 인권을 침해한 당사자에게 문제를 개선하도록 권고한다.

국민권익위원회는 부패 방지 및 국민의 권익 보호와 구제를 위한 국가기관이다. 국가기관의 잘못으로 인해 피해를 입은 국민은 국민권익위원회에 문제를 제기하고 자신이 입은 피해의 구제를 요청할 수 있다.

한편, 최근에는 소비자가 물건을 사거나 서비스를 이용하는 과정에서 부당한 피해를 입는 경우도 자주 발생하고 있다. 한국소비자원에서는 소비자를 대신해서 판매자를 상대로 소비자의 권리를 지켜주는 활동을 하고 있다. 피해를 입은 소비자는 구체적인 피해 사실을 한국소비자원에 알려서 상담을 받거나 피해를 구제받을 수 있다.

특별히 이민자나 외국인의 권리를 보호하고 도움을 주기 위한 전문적인 기관들도 존재 한다. 각 지역에는 이민자나 외국인을 위한 지원센터 등과 같은 단체들이 많이 활동 하고 있다. 이들은 한국에 거주하는 외국인이나 이민자가 한국 사회에 적응하는 것을 돕기도 하고, 한국 생활 중 겪은 피해나 불이익이 있을 경우 그것을 회복할 수 있도록 상담,소송진행등에서도움을주기도한다.그외에도각지역에있는주민자치센터와 같은 공공기관이나 시민단체 등에 문의하면 기본적인 도움을 받을 수 있다.",Cơ quan giúp bảo vệ quyền lợi nằm ở đâu?,What organizations can help protect rights?,"Với tư cách là một đất nước theo chủ nghĩa dân chủ, HQ đã và đang tạo ra nhiều chế độ để bảo vệ quyền lợi cho toàn dân. Do đó mỗi cá nhân cần hiểu rõ và vận dụng tích cực các chế độ này để bảo vệ không chỉ quyền lợi của bản thân mình mà còn cả quyền lợi của người khác.

국가인권위원회 (Ủy ban nhân quyền quốc gia) là cơ quan nhà nước để bảo vệ nhân quyền cơ bản cho tất cả mọi người. Những người bị xâm phạm nhân quyền như là bị phân biệt kì thị hoặc đối xử bất công bởi cơ quan nhà nước, công ty hay người khác, có thể yêu cầu xin tư vấn, điều tra, cứu trợ đến Ủy ban nhân quyền quốc gia để được giúp đỡ. Trường hợp được phán đoán rằng thực tế có sự vi phạm nhân quyền, Ủy ban nhân quyền quốc gia sẽ đưa ra các khuyến cáo cho bên vi phạm nhân quyền để cải thiện vấn đề. 

국민권익위원회 (Ủy ban quyền công dân) là cơ quan nhà nước về phòng chống tham nhũng và bảo vệ, hỗ trợ quyền lợi quốc dân. Người dân bị thiệt hại do lỗi của cơ quan nhà nước có thể đưa vấn đề lên Ủy ban quyền công dân và yêu cầu xin hỗ trợ cho tổn thất mình gặp phải.

Ngoài ra, gần đây cũng thường xuyên xảy ra trường hợp người tiêu dùng bị thiệt hại oan trong quá trình mua sản phẩm hoặc sử dụng dịch vụ. Ở cục bảo vệ người tiêu dùng Hàn Quốc đang thay mặt cho người tiêu dùng thực hiện các hoạt động bảo vệ quyền lợi của người tiêu dùng đối với người bán. Người tiêu dùng bị thiệt hại có thể báo cho cục người tiêu dùng Hàn Quốc về thực tế tổn thất một cách cụ thể để được tư vấn hoặc hỗ trợ tổn thất.

Đặc biệt, còn có các cơ quan chuyên trách để giúp đỡ và bảo vệ quyền lợi của cư dân hoặc người nước ngoài. Ở từng khu vực địa phương, có nhiều đoàn thể như là trung tâm hỗ trợ cho cư dân hoặc người nước ngoài đang hoạt động. Những nơi này cũng giúp đỡ người nhập cư hoặc người nước ngoài đang cư trú tại Hàn thích ứng với xã hội HQ và hỗ trợ các vấn đề như tư vấn, tiến hành kiện tụng để có thể phục hồi lại tổn thất trong trường hợp bạn bị thiệt hại hay gặp bất lợi khi đang sinh sống ở Hàn. Ngoài ra nếu hỏi các cơ quan công quyền hoặc đoàn thể nhân dân như trung tâm tự quản cư dân có ở mỗi địa phương, bạn cũng có thể nhận được sự giúp đỡ cơ bản.","As a democratic country, Korea has established several institutions to protect the rights of its people. Therefore, each individual needs to understand and actively use these systems to protect not only his own rights but also the rights of others.

The National Human Rights Commission of Korea is a national institution to protect the basic human rights of all people. Anyone who has been discriminated against by a national institution, company, or other person or has been violated by human rights such as unfair treatment can request help from the National Human Rights Commission of Korea for consultation, investigation, and relief. If it is determined that there has been a violation of human rights, the National Human Rights Commission of Korea recommends that the person who has violated human rights be improved.

The National Human Rights Commission is a national institution for the prevention of corruption and the protection and remedies of the rights and interests of the people. People who have been harmed by the wrongdoing of a national institution can raise a problem with the National Commission on Human Rights and request relief from the damage they have suffered.

On the other hand, in recent years, consumers often suffer from unfair damage in the process of buying goods or using services. Korea Consumer Resources is committed to protecting consumer rights against sellers on behalf of consumers. Damaged consumers can be informed of the specific damages by the Korea Consumer Agency for consultation or relief.

In particular, there are specialized institutions to protect and assist the rights of immigrants and foreigners. There are many organizations in each region, such as support centers for immigrants and foreigners. They also help foreigners and immigrants residing in Korea adjust to Korean society, and help with counseling and litigation so that they can recover from any damages or disadvantages they experience during their lives in Korea. You can get basic help by contacting public organizations such as the Residents' Autonomy Center or civic groups."
이민자 권리보호를 위해 노력하는 국가인권위원회,"국가인권위원회는 2014년 1월 한국방송공사 등 지상파4개 방송사 및 4개 종합편성 방송채널에 대해 외국인에 대한 차별적인 표현 등이 방송되지 않도록 유의할 것 등을 권고하였다. 이는 인권위원회가 2013년 5월부터 10월까지 지상파방송 4개사와 종합 편성방송 4개 채널 총 35개 방송 프로그램에 대한 모니터를 실시한 결과, 일부 프로그램 에서 정확한 사실에 근거하지 않거나, 출연자의 출신국가나 피부색 등에 대해 놀리 거나 비하하는 등의 차별적 표현을 사용해 특정 국가와 이주민에 대해 왜곡된 편견과 선입견을 불러일으킬 소지가 있었기 때문이다. 인권위원회는 이주민 및 외국인에 대한 차별적인 표현 등이 텔레비전을 통해 방송되지 않도록 유의할 것과 이를 방지할 수 있는 구체적인 방안을 마련할 것을 권고했다. <2014.01.10. 세계일보>",Ủy ban nhân quyền quốc gia đang nỗ lực để bảo vệ quyền lợi cho người nhập cư.,National Human Rights Commission working to protect immigrant rights,"Ủy ban nhân quyền quốc gia tháng 1 năm 2014 đã đưa ra khuyến cáo đến 4 đài phát thanh truyền hình mặt đất như là công ty phát thanh truyền hình HQ (KBS) và 4 kênh phát sóng tổng hợp cần lưu ý để không phát sóng những biểu hiện phân biệt kỳ thị đối với người nước ngoài. Điều này là vì theo kết quả giám sát đánh giá đối với tổng 35 chương trình phát sóng của 4 đài phát thanh truyền hình mặt đất và 4 kênh phát sóng tổng hợp tính từ tháng 5 đến tháng 10 năm 2013, ở một bộ phận các chương trình đã không căn cứ vào sự thật chính xác hoặc sử dụng các biểu hiện phân biệt kì thị như là giễu cợt hay coi thường đất nước xuất thân hoặc màu da của người biểu diễn, đã gây nên định kiến hoặc cái nhìn phiến diện không đúng đối với người nhập cư và một số quốc gia cá biệt. Ủy ban nhân quyền khuyến cáo lưu ý không phát sóng lên TV các biểu hiện phân biệt kì thị đối với người nhập cư và người nước ngoài và đưa ra những phương án cụ thể để có thể phòng tránh được vấn đề này. (Nhật báo thế giới 10/01/2014)","In January 2014, the National Human Rights Commission of Korea recommended to take care not to broadcast discriminatory expressions to foreigners about 4 terrestrial broadcasters such as the Korea Broadcasting Corporation and 4 comprehensive broadcasting channels. As a result of the Human Rights Committee's monitoring of a total of 35 broadcasting programs from 4 terrestrial broadcasters and 4 channels of comprehensive programming from May to October 2013, some programs are not based on accurate facts, or the country of origin This is because there was a possibility to provoke distorted prejudice and prejudice against specific countries and migrants by using differential expressions such as teasing or denigrating skin color. The Committee on Human Rights recommended noting that discriminatory expressions of migrants and foreigners are not broadcast on television, and recommending specific measures to prevent them. <2014.01.10. World Daily>"