Name,Script,name_vi,name_en,script_vi,script_en
"고대국가의 시작, 고구려와 백제","고조선이 멸망한 후 한반도에는 많은 국가들이 들어섰다. 그 중 백제, 고구려, 신라가 서로 경쟁하면서 삼국시대를 열었다.

삼국 중 먼저 발전한 나라는 백제이다. 백제는 한강유역에 자리를 잡아 농사짓기에 유리하였고 중국의 문물을 받아들이기에도 좋아 일찍이 전성기를 맞이하였다. 그리하여 4세기 근초고왕에 이르러 중국과 일본까지 진출하며 활발하게 무역하고 화려한 문화를 꽃피웠다. 백제의 가장 대표적인 유물로는 금동대향로와 금제장식이 있으며, 화려함과 섬세함이 돋보여 백제문화의 우수성을 알 수 있다.

고구려는 5세기 광개토대왕에 이르러 영토를 크게 넓혔다. 고구려는 북으로는 만주와 요동지방, 남으로는 한강 이남에 이르기까지 한국 역사상 가장 넓은 영토를 차지하였다. 이러한 광개토대왕의 업적은 광개토대왕릉비를 세워 기려졌는데 현재 중국 길림성에 이 비가 남아 있다. 고구려인들은 알아두기 활쏘기와 말타기를 즐겼 으며, 이러한 용감한 정신은 무용총에서 발견 된 벽화인 수렵도에서도 확인할 수 있다.","Sự bắt đầu của quốc gia cổ đại, Câu Cao Ly và Bách Tế ","The beginning of the ancient nation, Goguryeo and Baekje","Sau khi 고조선 (Triều Tiên Cổ) bị diệt vong có nhiều quốc gia đã được tạo dựng trên Bán đảo Triều Tiên. Trong đó  백제 (Bách Tế), 고구려 (Cao Câu Ly), và  신라 (Tân La) tranh giành nhau và mở ra thời kỳ tam quốc 

Đất nước phát triển nhất trong Tam Quốc là 백제 (Bách Tế). Bách Tế nắm giữ vị trí ở vùng lưu vực sông Hán thuận lợi cho việc canh tác và việc tiếp nhận được sản vật văn hóa của TQ cũng đa dạng hơn nên sớm mở ra được thời kỳ huy hoàng. Thành thử ra đến  thời của 근초고왕 (Cận Tiếu Cổ Vương) thế kỷ thứ 4 thì đã tiến ra ngoài giao thương sôi nổi với Trung Quốc cho đến cả Nhật Bản, mở ra một nền văn hóa rực rỡ. Các di vật được coi là tiêu biểu nhất của Bách Tế gồm có lò hương đồng mạ vàng và đồ trang trí làm bằng vàng, có độ rực rỡ và tinh xảo nổi bật nên có thể coi đây là nét vượt trội của nền văn hóa 백제 (Bách Tế). 

고구려 (Cao Câu Ly) đến thời của  광개토대왕 (Quảng Khai Thổ Đại Vương) thế kỷ thứ 5 đã mở rộng được lãnh thổ. 고구려 (Cao Câu Ly) có lãnh thổ lớn nhất trong lịch sử Hàn Quốc với phía bắc bao gồm Mãn Châu -만주 và Liêu Đông - 요동 (cả 2 bây giờ là lãnh thổ của TQ), phía nam trải dài đến tận phía nam sông Hán. Những thành tựu của 광개토대왕 (Quảng Khai Thổ Đại Vương) đã được lập bia tưởng niệm và hiện tại bia này đang nằm tại Cát Lâm (길림성) Trung Quốc. Người 고구려 (Cao Câu Ly) thích trò bắn cung và cưỡi ngựa, tinh thần dũng cảm này có thể thấy được trên 수렵도 - một bức bích họa được tìm thấy ở 무용총","After the fall of Gojoseon, many countries entered the Korean Peninsula. Among them, Baekje, Goguryeo, and Silla competed with each other to open the era of the Three Kingdoms.

Baekje was the first of the three countries to develop. Baekje settled in the Han River basin and was advantageous for farming, and it was also well received to accept Chinese culture, so it reached its heyday. Thus, in the 4th century, Geunchogo King reached China and Japan,
Traded and blossomed colorful culture. The most representative artifacts of Baekje are Geumdong Daehyangro and Geumje ornament, and the splendor and delicacy stand out to show the excellence of Baekje culture.

Goguryeo expanded its territory by reaching the Great King of Gwanggaeto in the 5th century. Goguryeo occupied the largest territory in Korean history, ranging from Manchuria and Yodong provinces to the north and south of the Han River to the south. The achievement of King Gwanggaeto the Great was erected in honor of the tomb of King Gwanggaeto, and this monument remains in Jilin Province, China. The Goguryeo people enjoyed knowing archery and horseback riding, and this brave spirit can be found in Hunting Island, a mural found in a dance gun."
일본으로 건너간 백제의 찬란한 문화,"일본의 역사서에는 일본(왜국)의 태자에게 유교의 경전을 가르쳐 준 스승으로 아직기와 왕인이라는 인물이 기록되어 있다. 근초고왕의 명령으로 말 두 필을 전해 주러 왜국에 건너갔던 아직기는 경전을 잘 읽어 왜국 태자의 스승이 되었다. 아직기가 왜국의 왕에게 왕인 박사를 소개하자 왜국 왕은 백제에 사신을 보내 왕인 박사를 모셔 왔다. 왕인은 왜인들에게 천자문과 논어 등을 가르쳤다. 백제는 이후에도 유교 경전에 능한 오경박사, 천문과 의학에 대한 지식을 가진 이들과 음악인들을 보내 주어 왜국의 발전에 많은 도움을 주었으며 불교문화도 전파하였다.",Nền văn hóa rực rỡ của Bách Tế vươn tới Nhật Bản,Baekje's brilliant culture that expanded to Japan,"Trong sử sách Nhật Bản có ghi chép nhân vật 아직기 (阿直岐) và 왕인 (王仁) là thầy dạy kinh sách  nho giáo cho thái tử của Nhật Bản (왜국 (倭國 - Uy Quốc). 아직기 đã băng đến 왜국 (Uy Quốc) để trao 2 con ngựa theo lệnh của 근초고왕 (Cận Tiếu Cổ Vương), ông đọc kinh sách rất giỏi và trở thành thầy của thái tử 왜국 (Uy Quốc). 아직기 tiến cử bậc thầy 왕인 với vua của Uy Quốc, vua Uy Quốc ngay lập tức phái sứ thần đến 백제 (Bách Tế) để tháp tùng 왕인. 왕인 đã dạy thiên tự văn và luận ngữ cho người dân 왜국 (Uy Quốc). 백제 (Bách Tế) về sau cũng đã gửi các bậc thầy ngũ kinh thông thạo kinh sách nho giáo, các chuyên gia có kiến thức về thiên văn và y học cùng các thầy âm nhạc đến và giúp ích rất nhiều cho sự phát triển của 왜국 (Uy Quốc),và còn cả truyền bá văn hóa Phật giáo.","In the history book of Japan, a teacher who teaches the scriptures of Confucianism to the crown prince of Japan (Warland) has been recorded as a character named Yetigi and Wangin. As the command of King Geunchogo, he went to Waeguk to deliver two horses, and he read the scriptures well and became the teacher of the Prince of Waeguk. When Dr. yet Gigi introduced Dr. Wang, the king of the country, the king of the country sent a messenger to Baekje to bring him back. The royal man taught dwarfmen cheonjamun and non-language. Baekje later sent Dr. Oh Kyung who was fluent in Confucian scriptures, as well as musicians and musicians with knowledge of astronomy and medicine, which helped the development of the country and spread Buddhist culture."
"삼국통일의 꿈을 이룬 나라, 신라 ","신라는 삼국 중 가장 늦게 국가로서의 모양새를 갖 추었지만 꾸준히 발전하였다. 6세기 무렵 진흥왕은 화랑도를 통해 인재를 길러냈고, 백제와 동맹을 맺 어 고구려의 영토였던 한강 상류지역을 차지한 뒤 백제의 한강 하류까지 빼앗으며 영토를 확장해 나갔 다. 그리하여 한강유역을 차지한 신라는 중국과 교 류하며 삼국통일의 발판을 마련하였고 진흥왕 순수 비를 통해 이러한 업적을 기념하였다.

이후에도 신라는 백제, 고구려와 경쟁을 벌이며 삼 국 통일을 위한 노력을 계속하였고 마침내 676년 한 국 최초의 통일국가를 이루었다.

통일 이후 신라는 서라벌(오늘날의 경주)을 수도로 삼고 더욱 크게 발전해 나갔다. 동양에서 가장 오래된 천문대인 첨성대를 만들어 별자리를 관측하였고, 농업을 발전시켰다. 불교를 장려하여 불국사, 다보탑, 석가탑, 석굴암 등 찬란한 불교 문화를 꽃피웠다. 또한 장보고가 완도에 설치한 청해진이 동아시아 해상 무역의 중심지 역할을 하며 통일신라는 한층 발전해나갔다.
그러나 시간이 흐르면서 신분 제도의 한계와 지배층의 사치로 백성은 혼란에 빠졌고 결국 통일신라는 후백제, 후고구려, 신라의 삼국으로 나뉘어졌다. 이를 후삼국시대 라고 한다.","Đất nước thực hiện giấc mơ thống nhất Tam Quốc, Tân La","Silla, the country that achieved the dream of unification","신라 (Tân La) mang diện mạo là đất nước muộn nhất trong tam quốc nhưng phát triển rất đều đặn. Vào khoảng thế kỷ thứ 6, 진흥왕 (Chấn Hưng Vương) đã rèn luyện được nhiều nhân tài thông qua Đội Hoa Lang (화랑도), trở thành đồng minh của Bách Tế và sau khi chiếm được khu vực thượng lưu sông Hán - lãnh thổ của Cao Câu Ly thì chiếm luôn hạ lưu sông Hán của 백제 (Bách Tế) và bành trướng lãnh thổ. Vì thế, 신라 (Tân La) sau khi chiếm được lưu vực sông Hán, đã giao lưu quan hệ với Trung Quốc để tạo bàn đạp thống nhất tam quốc, và kỷ niệm chiến công này bằng cách lập bia 진흥왕 순수비

Về sau, 신라 (Tân La) vẫn liên tục khởi xướng chiến tranh với 백제 (Bách Tế), 고구려 (Cao Câu Ly) và không ngừng nỗ lực để thống nhất tam quốc, cuối cùng thì năm 676 đã tạo được quốc gia thống nhất đầu tiên của Hàn Quốc.

Sau khi thống nhất, 신라 (Tân La) đã lấy 서라벌 (hiện nay là 경주) làm thủ đô và càng phát triển lớn mạnh. Làm ra 첨성대 - đài thiên văn lâu đời nhất phương đông để quan sát các chòm sao, và phát triển nông nghiệp. Khuyến khích Phật giáo và làm rực rỡ nền văn hóa Phật giáo với những công trình như Phật Quốc Tự (불국사), Tháp Đa Bảo (다보탑), Tháp Thích Ca (석가탑), Thạch Quật Am (석굴암)  vv…Ngoài ra  청해진 được 장보고 (Trương Bảo Cao ) cho xây dựng ở 완도 giữ vai trò là vùng trọng điểm của giao thương trên biển Đông Á, từ đó 신라 (Tân La) đã phát triển thêm một bậc. 

Tuy nhiên thời gian trôi qua, bách tính đã rơi vào hỗn loạn do sự ăn chơi xa xỉ của tầng lớp cai trị và giới hạn của chế độ cấp bậc (chế độ phân biệt giai cấp), kết cuộc là 신라 (Tân La) thống nhất đã bị chia ra thành tam quốc gồm 후백제, 후고구려, 신라 (Hậu Bách Tế, Hậu Câu Cao Ly và Tân La). Đây được gọi là 후삼국시대 (Thời kỳ Hậu Tam Quốc)","Silla had the shape of a state as the last of the three countries, but it continued to develop. Around the 6th century, King Jinheung raised talents through Hwarangdo, and formed an alliance with Baekje to occupy the upper reaches of the Han River, which was the territory of Goguryeo, and took it down to the lower Han River of Baekje to expand the territory. Thus, Silla, which occupied the Han River basin, exchanged with China, laid the groundwork for the unification of the Three Kingdoms, and celebrated this achievement through the pure rain of King Jinheung.

Afterwards, Silla continued to compete with Baekje and Goguryeo and continued efforts to unify the three countries, and finally became the first unified nation in Korea in 676.

After reunification, Silla made Seorabeol (Today's Gyeongju) the capital and developed further. Cheomseongdae, the oldest astronomical observatory in the Orient, was observed and constellations were observed and agriculture was developed. By encouraging Buddhism, it bloomed brilliant Buddhist culture such as Bulguksa Temple, Dabo Pagoda, Seokga Pagoda, and Seokguram. In addition, Cheonghae, established by Jango Bogo in Wando, served as the center of maritime trade in East Asia and further developed the Unified Silla.
However, as time passed, the limitations of the status system and the luxury of the ruling class made the people confused, and eventually they were divided into the Three Kingdoms of Hubaek Baekje, Hugo Goguryeo, and Silla. This is called the era of the Three Kingdoms."
발해는 어떤 나라였을까?,"발해는 고구려가 멸망한 후, 대조영이 고구려 사람들을 이끌고 옛 고구려 땅인 만주에서 세운 나라이다. 발해는 고구려를 계승하여 씩씩하고 독창적인 문화를 발전시켜 나갔다. 가장 영토가 넓었던 9세기에는 고구려의 옛 땅을 대부분 되찾았다. 당시 중국에서는 발해를 ‘바다 동쪽의 큰 나라’라는 뜻의 ‘해동성국(海東盛國)’이라고 불렀다. 신라가 삼국을 통일하고 북쪽에서는 대조영이 발해를 건국하면서 남쪽의 신라와 북쪽의 발해가 함께 있던 시기를 남북국시대라고 부르기도 한다.",발해 - Bột Hải là quốc gia nào?,Which country was 발해?,"발해 (Bột Hải) là đất nước sau khi 고구려 (Cao Câu Ly) sụp đổ, do 대조영 (Đại Tộ Vinh) dẫn dắt những người 고구려 (Cao Câu Ly) cùng lập nên ở Mãn Châu, vốn là vùng đất của 고구려 (Cao Câu Ly) ngày xưa. 발해 (Bột Hải) kế thừa 고구려 (Cao Câu Ly) và thúc đẩy phát triển văn hóa một cách mạnh mẽ và sáng tạo. Thế kỷ thứ 9 là thời lãnh thổ rộng lớn nhất, đã giành lại được phần lới đất ngày xưa của 고구려 (Cao Câu Ly). Ở Trung Quốc đương thời gọi 발해 (Bột Hải) là ‘해동성국' (Hải Đông Thành Quốc) có nghĩa là 'quốc gia rộng lớn ở biển Đông'. Cùng với việc 신라 (Tân La) thống nhất tam quốc và 대조영 (Đại Tộ Vinh) lập nước 발해 (Bột Hải) ở phía bắc, thời kỳ cùng tồn tại song song nước 신라 (Tân La) phía nam và 발해 (Bột Hải) phía bắc còn được gọi là '남북국시대' (Thời kỳ Nam Bắc Quốc)","Balhae is a country founded in Manchuria, the former land of Goguryeo, after Daeguyoung led the people of Goguryeo after the fall of Goguryeo. Balhae succeeded Goguryeo and developed a strong and original culture. In the 9th century, when the territory was the largest, most of the old land of Goguryeo was recovered. At that time, in China, Balhae was called ‘Haedongseongguk(海東盛國)’, meaning ‘big country east of the sea’. When Silla unified the Three Kingdoms and Daejo Young founded Balhae in the north, the time when Silla in the south and Balhae in the north were together is sometimes called the period of inter-Korean countries."