Name,Script,name_vi,name_en,script_vi,script_en
한국에는 어떤 방송과 신문이 있을까?,"한국 사회를 이해하기 위해서는 한국 안팎에서 일어 나는새로운소식이나여러가지정보를빠르게접하 고 습득해야 할 필요가 있다. 한국의 다양한 TV 및 라디오 프로그램, 신문 등은 많은 사람들에게 유용한 정보를 제공하는 대표적인 대중매체이다.
TV는 뉴스, 드라마, 스포츠 등 다양한 프로그램을
통해 유용한 정보와 상식, 흥밋거리 등을 제공한다. 한국의 TV 공중파 채널로는 KBS, MBC, SBS, EBS 등이 있다. 이 중 EBS는 주로 교육과 관련된 프로그램을 방송하고 있고, 다른 방송사들은 교양, 오락, 스포츠 등 다양한 프로그램을 두루 제공한다. KBS는 공영방송사로서 MBC나 SBS에 비해 광고를 많이 하지 않는 대신 TV 수신료를 받고 있다.
라디오에서도 다양한 프로그램을 들을 수 있다. KBS, MBC, SBS, EBS 등에서는 뉴스, 교양, 음악, 오락 프로그램 등을 제공하고 EBS 라디오 채널에서는 영어를 비롯한 세계 여러 나라 언어를 학습할 수 있는 프로그램이 방송된다. 또한, TBS 처럼 실시간 교통정보를 전해주는 프로그램도 많아서 운전하면서 라디오를 듣는 사람들이 적지 않다.
신문은 중요한 사건이나 화제를 지면(종이)을 통해 보여주는 것으로 일요일을 제외 하고는 거의 매일 발행된다. 조선일보, 중앙일보, 동아일보, 한국일보, 한겨레, 경향신문 등과 같이 정치, 경제, 사회, 문화, 국제, 스포츠 등을 두루 다루는 종합 일간지도 있고, 경제나 스포츠 등만을 전문적으로 다루는 신문도 있다. 또한 부산 일보, 광주일보, 충청매일 등과 같이 각 지방의 소식을 보다 많이 전하는 지역 신문도 있다. 신문을 보기 위해서는 집에서 정기구독을 할 수도 있고 필요할 때마다 지하 철역이나 버스 정류장, 편의점 등에서 살 수도 있다.",Truyền hình và báo chí Hàn Quốc, Korea’s broadcast and newspaper,"Để hiểu xã hội Hàn Quốc thì việc quan trọng là phải nhanh chóng nắm bắt và tiếp nhận những tin tức mới xảy ra trong ngoài nước hay nhiều thông tin khác nhau. Các chương trình tivi, radio, hay báo chí của Hàn Quốc là những phương tiện truyền thông đại chúng tiêu biểu cung cấp các thông tin hữu dụng tới nhiều người.
Tivi cung cấp các thông tin hữu dụng, thường thức hay chuyện thú vị, vv thông qua nhiều chương trình như tin tức, phim truyện, thể thao, vv. Các kênh truyền hình đại chúng của Hàn Quốc gồm có KBS, MBC, SBS, EBS, vv.  Trong đó EBS chủ yếu phát sóng các chương trình liên quan về giáo dục. Các nhà đài khác cung cấp đồng đều các chương trình như giáo dưỡng, giải trí, thể thao, vv. KBS là đài phát sóng quốc doanh, thay vì ko có nhiều quảng cáo so với MBC hay SBS, nên có thu phí xem truyền hình.
Bạn cũng có thể nghe nhiều chương trình từ radio. Các đài KBS, MBC, SBS, EBS, vv cung cấp các chương trình như tin tức, giáo dưỡng, âm nhạc, giải trí, vv và đài EBS phát sóng các chương trình học ngoại ngữ của nhiều quốc gia trên thế giới, điển hình như tiếng anh. Ngoài ra, các chương trình truyền tải thông tin giao thông thời gian thực cũng nhiều nên số người nghe radio khi lái xe cũng ko ít.
Báo chí là việc trưng bày các sự việc hay chủ đề quan trọng trên mặt giấy mà ngoài trừ chủ nhật thì gần như được phát hành hàng ngày. Có những báo ra hàng ngày cung cấp thông tin đồng đều về chính trị, kinh tế, xã hội, văn hóa, quốc tế, thể thao,vv như nhật báo Joseon -조선일보, nhật báo trung ương -중앙일보, nhật báo donga -동아일보, 한국일보, 한겨래, 경향신문, vv và cũng có báo chỉ bàn về chuyên môn như kinh tế hay thể thao. Ngoài ra, cũng có những thời báo khu vực mà cung cấp nhiều tin tức của mỗi địa phương như  nhật báo busan -부산일보, nhật báo kwangju -광주일보, nhật báo choongcheong -충청일보, vv. Để đọc báo, bạn có thể đăng ký mua định kỳ -정기구독 ở nhà, hay mỗi khi cần thì cũng có thể mua ở bến tàu điện ngầm, bến xe bus, hay cửa hàng tiện lợi.","In order to understand Korean society, it is necessary to learn new news and various information from inside and outside of Korea. Various TV and radio programs and newspapers in Korea are representative mass media that provide useful information to many people.
TV provides useful information, common sense, and entertainment through diverse programs such as news, drama and sports. Korean TV channels include KBS, MBC, SBS and EBS. Among them, EBS mainly broadcasts education-related programs. Other broadcasters offer a wide range of programs, including culture, entertainment and sports. As a public broadcaster, KBS does not advertise as much as MBC or SBS, but charges TV license fees.
You can also listen to various programs on the radio. KBS, MBC, SBS and EBS provide news, culture, music and entertainment programs, while EBS radio channels air programs that allow students to learn English and other languages around the world. Also, many people listen to the radio while driving because there are many programs that deliver real-time traffic information while driving.
Newspapers are published almost every day except on Sundays, as they show important events or topics on paper. There are also daily papers that cover politics, economy, society, culture, international, sports, etc. such as Chosun Daily, JoongAng Daily, Dong-A Daily, Hankook Daily, Hankyoreh, and Kyunghyang Shinmun, and newspapers that specialize in economy and sports. In addition, there are more local newspapers such as the Busan Daily, the Gwangju Daily, and the Chungcheong Maeil, that report more local information. To read newspapers, you can subscribe at home, or buy them at subway stations, bus stops, or convenience stores whenever you need."
TV로 더 다양한 프로그램을 보고 싶다면?,"공중파 채널이라 불리는 KBS, EBS, MBC, SBS는 특별한 비용 부담없이 자유롭게 시청할 수 있다 (단, KBS 수신료 부담은 예외). 그러나 매달 어느 정도의 비용을 부담하면 매우 다양한 프로그램을 볼 수있는 방법이 있다. 대표적인 것이 케이블 방송이다. 케이블 방송에서는 드라마, 영화, 오락, 뉴스, 스포츠, 홈쇼핑, 종교, 교육 등 약 100 여개 이상의 채널을 통해 각자가 관심을 갖는 분야의 프로그램을 24시간 내내 볼 수 있다. 또한 공중파 등을 통해 이미 방영된 프로그램을 다시 볼 수 있는 서비스도 제공되고 있어서 시간에 관계없이 시청할 수 있다는 장점이 가지고 있다.",Nếu muốn xe nhiều chương trình hơn trên TV?,Want to watch more TV programs?,"KBS, EBS, MBC, SBS được gọi là các kênh truyền hình đại chúng có thể xem tự do mà ko phải chịu phí đặc biệt nào (ngoại trừ kênh KBS thu phí). Tuy nhiên nếu bạn chịu trả một mức phí nào đó hàng tháng thì có phương pháp mà bạn có thể xem được nhiều chương trình hơn nữa. Ở truyền hình cáp -케이블 방송, với khoảng trên 100 kênh về phim truyền hình, movie, giải trí, tin tức, thể thao, mua sắm tại nhà -홈쇼핑, tôn giáo, giáo dục, vv... các chương trình phù hợp với quan tâm của mỗi người có thể xem suốt 24 giờ. Ngoài ra nó cũng có ưu điểm là cung cấp dịch vụ có thể xem lại các chương trình đã chiếu, như trên truyền hình đại chúng, nên bất kể thời gian nào cũng có thể xem được.","KBS, EBS, MBC and SBS, called public channels, are free to watch without any special cost (except for the KBS license fee). However, there is a way to see a wide variety of programs at a certain cost each month. The typical one is cable broadcasting. In cable broadcasting, programs in areas of interest can be viewed 24 hours a day through more than 100 channels, including dramas, movies, entertainment, news, sports, home shopping, religion and education. It also has the advantage of being able to watch programs that have already been aired, regardless of time."
한국에서 인터넷은 어떻게 사용되고 있을까?,"인터넷이 발전하면서 많은 사람들이 스스로 원하는 정보를 찾아내고, 자신이 만든 정보를 다른 사람들에게 전달하거나 공유하는 방식이 늘어나고 있다. 특히 인터넷은 전 세계적으로 연결되어 있기 때문에 오늘날 정보를 얻는데 가장 유용한 대중매체 의 하나로 평가받고 있다.
한국은 전국 곳곳에 인터넷이 널리 보급되어 있기 때문에 어디서나 손쉽게 인터넷을 이용할 수 있다. 그래서 이메일을 통해 소식이나 중요한 문서 등을 주고받는 사람도 많고, 인터넷을 이용하여 물건을 사거나 은행 업무 등을 보는 사람도 많다. 또한, 자신이 관심을 갖는 내용을 블로그 등을 통해 표현하기도 하고, 관심 분야가 비슷한 사람들끼리 인터넷으로 카페나 커뮤니티 등을 만들어 서로 도움을 주고 받기도 한다. 특히 이민자들의 경우 각자의 관심이나 출신국가에 따라서 인터넷 카페를 만들어 연락을 주고받거나 유용한 정보를 공유하는 경우가 많다.
최근에는 특히 인터넷을 이용하여 개인들끼리 직접 소통하는 SNS(소셜 네트워크 서비스)가 많은 주목을 받고 있다. 특히 휴대전화나 태블릿 PC를 통해 SNS를 하는 사람들이 늘어나면서 자신의 생각이나 다른 사람들의 의견을 서로 전달하고 공유 하는 경우도 많아졌다. 한국에 와 있는 외국인들도 SNS를 이용하여 멀리 있는 가족이나 친구들과 실시간으로 의사소통할 수도 있다.",Internet được sử dụng ở Hàn Quốc ra sao?,How Internet is used in Korea?,"Khi internet phát triển nhiều người tìm thấy thông tin họ mong muốn, và phương thức truyền tải hay chia sẻ thông tin mình làm ra tới người khác ngày càng gia tăng. Đặc biệt vì internet kết nối toàn thế giới nên ngày nay internet được xem như phương tiện truyền thông đại chúng hữu dụng nhất.
Ở Hàn Quốc vì internet được phổ cập rộng rãi trên toàn quốc nên có thể sử dụng internet dễ dàng ở mọi nơi. Do đó người nhận tin tức hay văn bản quan trọng qua email cũng nhiều, và người dùng internet để mua đồ hay giao dịch ngân hàng -은행 업무 cũng vậy. Ngoài ra, việc thể hiện những thứ mình quan tâm qua blog cũng có, và những người có cùng lĩnh vực quan tâm thì lập ra các cafe hội hay nhóm cộng đồng - 카페나 커뮤니티 để cùng giúp đỡ và chia sẻ với nhau. Đặc biệt trường hợp những người nhập cư thì tùy theo quan tâm của mỗi người hay quốc gia xuất thân thì nhiều cafe hội internet được lập ra để giúp liên lạc và chia sẻ các thông tin hữu dụng.
Gần đây, mạng xã hội (SNS: social network service) giúp các cá nhân giao tiếp trực tiếp với nhau khi sử dụng internet đang nhận được nhiều quan tâm. Đặc biệt khi nhiều người sử dụng mạng xã hội bằng điện thoại và máy tính bảng tăng lên thì việc truyền tải ý kiến cá nhân - 자신의 생각 hay quan điểm của người khác với nhau cũng trở nên phổ biến. Những người nước ngoài ở Hàn Quốc cũng đang sử dụng mạng xã hội để liên lạc trực tuyến với gia đình và bạn bè sống ở xa.","With the development of the Internet, many people are finding ways to find the information they want and passing or sharing the information they have created to others. In particular, since the Internet is connected worldwide, it is regarded as one of the most useful media to obtain information today.
In Korea, the Internet is widely distributed all over the country, so you can easily use the Internet anytime soon. Therefore, there are many people who exchange news or important documents through e-mail, and there are many people who buy things or do banking through the Internet. In addition, they express their interests through blogs, etc., and people with similar interests create cafes or communities on the Internet to help each other. In particular, immigrants often create Internet cafes to communicate or share useful information depending on their interests or countries of origin.
Recently, SNS (social network service) that communicates directly among individuals using the Internet has received much attention. In particular, as more and more people use SNS through mobile phones and tablet PCs, more and more people communicate their thoughts and opinions to each other. Foreigners in Korea can also use SNS to communicate with their families and friends in real time."
한국인의 생활 속에 파고든 SNS,"한국에서도 많은 사람들이 카카오톡 · 트위터 · 페이스북, 블로그 등 다양한 SNS를 사용하고있다. SNS를 통해 친구나 가족과 소식을 주고받을 뿐 아니라 모르는 사람들하고도 관심을 가지고 있는 것들을 서로 나누기도 한다. 최근에는 이러한 SNS의 특성을 살려 개인 · 기업의 마케팅이나 광고에도 다양하게 이용되고 있다.",Mạng xã hội đi vào sinh hoạt của người Hàn Quốc,SNS penetrated into Korean life,"Ở Hàn Quốc nhiều người đang sử dụng các mạng xã hội như Kakaotalk, Twitter, Facebook, blog, vv. Thông qua mạng xã hội bạn ko chỉ trao đổi với gia đình hay bạn bè và nhận tin tức mà kể cả những người ko biết mà có cùng quan tâm cũng có thể chia sẻ với nhau. Gần đây, các đặc điểm của mạng xã hội cũng đang được sử dụng rộng rãi trong tiếp thị và quảng cáo của các cá nhân và công ty.","In Korea, many people use various social networking sites such as Kakao Talk, Twitter, Facebook, and blogs. Not only do we exchange news with friends and family through SNS, but we also share things we are interested in with strangers. Recently, it has been used in various ways for marketing and advertising of individuals and businesses, taking advantage of these characteristics of SNS."