Name,Script,name_vi,name_en,script_vi,script_en
한국의 사회복지제도에는 어떤 것들이 있을까?,"한국에서는 국민이 최소한의 인간다운 삶을 누릴 수 있도록 다양한 사회복지제도를 마련해 두고 있다. 한국의 사회복지제도는 크게 사회보험, 공공부조, 사회복지서비스로 나눌 수 있다.
사회보험은 미래의 위험에 대비하여 국가의 법에 따라 국민들이 가입해야 하는 제도이다. 사회보험에 가입하게 되면 노인이 되거나 건강이 나빠지는 등의 어려운 상황을 겪게 되었을 때 일정 부분 국가의 지원을 받을 수 있다. 사회보험에는 크게 건강보험, 고용보험, 국민연금, 산업재해보상보험의 네 가지가 있다.
건강 보험: 아파서 병원에 갈때 의료비 일부를 지원 받을 수 있다
고용보험: 회사에서 해고 되었을 때 일정 기간 금전적 지원을 받을 수있다.
국민보험: 나이가 많아 돈을 벌기 어려울 때 일정 금액을 생활비로 지급 받을 수 있다.
산업재해보상보험: 회사에서 일하다가 사고로 다쳤을 때 피해에 대해 보상받을 수 있다
공공부조는 생활 능력이 없는 사람들의 기본적 인 생활수준을 보장해 주기 위해 국가나 지방자치단체가 지원하는 것을 말하다. 대표적은 공공부조 정책으로는 국민기초생활보장제도와 의료급여제도가 있다. 소득이 최저생계비보다 적은 저소득층은 국민기초생활보장제도를 통해 생활비를 지원 받을 수 있으며, 의료급여제도를 통해 의료비를 지원받을 수 있다.
사회복지서비스는 어떤 어려움을 겪는 사람들에게 금전적 지원이 아닌, 실제적, 직접적, 전문적 도움을 제공하는 제도이다. 여기에는 노인복지, 아동복지, 청소년복지, 여성복지, 한부모가정복지 등이 있으며 주로 상담, 재활, 직업 훈련, 사회복지시설 이용 등의 서비스를 제공한다.",Chế độ phúc lợi xã hội Hàn Quốc,Korea’s social welfare system,"Ở Hàn Quốc, để công dân có thể hưởng thụ cuộc sống con người tối thiểu thì nhiều chế độ phúc lợi xã hội đã được ban hành. Chế độ phúc lợi xã hội Hàn Quốc có thể chia thành bảo hiểm xã hội - 사회보험, phụ cấp cộng đồng -공공부조, và dịch vụ phúc lợi xã hội - 사회복지서비스.
Bảo hiểm xã hội -사회보험 hay 4대보험 là chế độ mà công dân phải tham gia theo luật quốc gia để dự phòng cho các mối nguy hiểm trong tương lai. Nếu bạn được tham gia bảo hiểm xã hội thì khi trải qua những lúc khó khăn như lúc về già hay sức khỏe yếu đi, vv bạn có thể nhận được 1 khoản trợ cấp quốc gia nhất định. Bảo hiểm xã hội có 4 loại là bảo hiểm sức khỏe -건강보험, bảo hiểm thất nghiệp -고용보험, bảo hiểm hưu trí - 국민연금, và bảo hiểm bồi thường tai nạn lao động -산업재해보상보험.
Bảo hiểm sức khỏe: khi bị ốm và đi tới bệnh viện, có thể nhận 1 phần tiền trợ cấp chi phí y tế.
Bảo hiểm thất nghiệp: khi bị công ty xa thải thì có thể nhận trợ cấp bằng tiền trong 1 khoảng thời gian nhất định
Bảo hiểm hưu trí: khi nhiều tuổi khó kiếm tiền thì có thể nhận trợ cấp sinh hoạt phí nhất định
Bảo hiểm bồi thường tai nạn lao động: khi làm việc ở công ty thì bị thương do tai nạn thì có thể nhận bồi thường theo thiệt hại.
Phụ cấp cộng đồng -공공부조 là nói về việc quốc gia hay chính quyền tự trị địa phương trợ cấp để giúp đảm bảo tiêu chuẩn sống cơ bản cho những người ko có khả năng sinh hoạt tối thiếu. Thông qua chính sách phụ cấp cộng đồng thì có chế độ đảm bảo sinh hoạt cơ bản - 국민기초생활보장제도 và chế độ chi trả y tế -의료급여제도. Người thuộc tầng lớp thu nhập thấp -저소득층 mà có thu nhập hàng năm -소득 nhỏ hơn sinh hoạt phí tối thiểu -최저생계비 thì có thể nhận trợ cấp sinh hoạt phí thông qua chế độ trợ cấp sinh hoạt cơ bản và nhận trợ cấp chi phí y tế thông qua chế độ trợ cấp y tế.
Dịch vụ phúc lợi xã hội -사회복지서비스 là chế độ cung cấp hỗ trợ mang tính thực tế, trực tiếp, chuyên môn mà ko hỗ trợ tài chính tới những người gặp khó khăn nào đó. Tại đây có phúc lợi người già, trẻ sơ sinh và trẻ nhỏ, thiếu niên, nữ giới, và gia đình bố mẹ đơn thân, vv chủ yếu cung cấp các dịch vụ tư vấn, hồi phục chức năng, đào tạo nghề, hay sử dụng các cơ sở phúc lợi xã hội.","In Korea, various social welfare systems are set up so that people can enjoy a minimal human life. Korea's social welfare system can be largely divided into social insurance, public assistance and social welfare services.
Social insurance (사회보험) is a system that people must subscribe to in accordance with national laws in preparation for future risks. If you sign up for social insurance, you can get some government support when you experience difficult situations such as becoming an elderly person or becoming unhealthy. There are four main types of social insurance: health insurance, employment insurance, national pension and industrial accident compensation insurance.
Health insurance: Part of your medical expenses can be provided when you go to the hospital because you are sick.
Employment insurance: You can get financial support for a certain period of time when you are fired from the company.
National Insurance: When you are too old to make money, you can get a certain amount of money for living expenses.
Industrial Accident Compensation Insurance: You can be compensated for damages if you are injured in an accident while working for a company.
Public assistance (공공부조) refers to the support of the state or local governments to ensure the basic living standards of those who do not have the ability to live. The typical policies of public assistance include the National Basic Livelihood Security System (국민기초생활보장제도) and the medical benefits system (의료급여제도). Low-income families with less than the minimum cost of living can receive living expenses through the National Basic Livelihood Security System, and medical expenses can be supported through the medical benefits system.
Social welfare services (사회복지서비스) are a system that provides practical, direct and professional help, not financial support, to those who suffer any difficulties. These include elderly welfare, child welfare, youth welfare, women's welfare and single-parent family welfare, and mainly provide services such as counseling, rehabilitation, vocational training and use of social welfare facilities."
외국인 대상 복지 서비스에는 무엇이 있을까,"사회복지제도 중 공공부조는 원칙적으로 한국 국민들에게만 적용된다. 하지만 외국인 중에서도 일정한 조건에 해당하는 사람들은 그 혜택을 받을 수 있다. 예를 들면, 국내에 체류하고 있는 외국인이 한국 국민과 결혼하여 본인 또는 배우자가 임신 중인 경우, 외국인이 대한민국
   국적의 미성년 자녀를 양육하고 있는 경우에는 공공부조 혜택을 받을 수 있다. 이러한 조건에 해당하는 사람들은 최저생계비지원과 무료의료지원 등을 받을 수 있다.
또한, 외국인도 사회복지 서비스를 받을 수 있는데 예를 들어, 임신 중이거나 출산을 앞둔 결혼이민자에게 산모와 신생아의 건강관리에 필요한 임신과 출산 지도 서비스가 제공되고 있다. 그리고 언어나 학업 등에 어려움을 겪는 만 3~12세의 자녀를 위해 가정에 직접 방문하여 도움을 주는 자녀 생활서비스가 제공되기도 한다. 그 외에도 한국 생활 적응 및 취미 활동 등을 위한 다양한 서비스가 지원되고 있다.",Dịch vụ phúc lợi cho người nước ngoài ở Hàn,Welfare services for foreigners in Korea,"Trong số các chế độ phúc lợi xã hội -사회복지제도 thì phụ cấp cộng đồng -공공부조 theo nguyên tắc chỉ áp dụng cho công dân Hàn Quốc. Trong số những người nước ngoài mà thỏa mãn một số điều kiện nhất định thì cũng có thể nhận được lợi ích trên. Ví dụ người nước ngoài đang cư trú tại Hàn Quốc mà chính mình kết hôn với công dân Hàn Quốc hoặc có bạn đời đang mang thai, người ngoại quốc đang nuôi dưỡng con cái chưa vị thành niên có quốc tịch Hàn thì có thể nhận được phụ cấp cộng đồng. Những người thỏa mãn điều kiện như vậy thì có thể nhận trợ cấp sinh hoạt phí tối thiểu -최저생계비지원 và trợ cấp y tế miễn phí -무료의료지원, vv.
Ngoài ra, người nước ngoài cũng có thể nhận các dịch vụ phúc lợi xã hội -사회복지서비스, ví dụ như đang cung cấp dịch vụ hỗ trợ thai sản và sinh đẻ cần thiết để quản lý sức khỏe của bà mẹ và trẻ sơ sinh cho các phụ nữ nhập cư đang mang thai hay trước và sau sinh. Và cho các trẻ em từ 3 - 12 tuổi gặp các vấn đề khó khăn trong ngôn ngữ, học tập, vv dịch vụ ghé thăm trực tiếp gia đình để giúp đỡ trẻ cũng đang được cung cấp. Ngoài ra nhiều hoạt động để thích ứng với cuộc sống tại Hàn, sở thích, vv cũng đang được hỗ trợ.","Among social welfare systems, public assistance applies only to Korean citizens in principle. However, those who meet certain conditions among foreigners can benefit from the benefits. For example, if a foreigner staying in Korea is married to a Korean citizen and his or her spouse is pregnant, or if a foreigner is raising a minor child of a Korean nationality, he or she can receive public assistance benefits. Those who meet these conditions can receive minimum cost of living (최저생계비지원) and free medical assistance (무료의료지원).
Also, foreigners can receive social welfare services, such as pregnancy and childbirth guidance services necessary for the health care of mothers and newborns, for example, married immigrants who are pregnant or about to give birth. In addition, children's living services are provided to help children aged 3-12 who have difficulty in language or study at home. In addition, various services such as adaptation to life and hobby activities in Korea are supported."
외국인의 한국 생활 적응에 도움을 주는 안내 센터는?,우선 법무부에서 운영하고 있는 외국인종합안내센터 (1345)가 있다. 이곳은 외국인의 한국 생활 적응에 필요한 출입국 민원 상담과 관련 생활 정보 안내를 20개 언어로 온라인과 전화를 통해 제공하는 민원안내 창구의 역할을 한다.,Trung tâm thông tin hỗ trợ thích ứng với cuộc sống tại Hàn cho người nước ngoài.,Information center to help foreigners adapt to life in Korea,"Trước tiên là trung tâm thông tin tổng hợp người nước ngoài (1345) -외국인종합안내센터 đang hoạt động tại bộ pháp vụ -법무부. Nơi này đóng vai trò là cửa sổ thông tin dân sự -민원안내 창구 cung cấp dịch vụ tư vấn qua điện thoại trên 20 ngôn ngữ về tư vấn dân sự xuất nhập cảnh -출입국 민원 상담 và thông tin đời sống liên quan -관련 생활 정보 안내 cần thiết để thích ứng với cuộc sống tại Hàn cho người nước ngoài
Ngoài ra tổng đài danuri (1577-1366) -다누리콜센터 cung cấp dịch vụ thông tin về đời sống qua 13 ngôn ngữ để giúp đỡ những người kết hôn nhập cư -결혼이민자 thích nghi với cuộc sống ở Hàn tại bộ phụ nữ và gia đình -여성가족부 cũng đang hoạt động. Thêm nữa, trung tâm hỗ trợ khẩn cấp cho phụ nữ nhập cư để tránh bạo lực gia đình cũng hoạt động suốt 24h.","First of all, there is the Foreign Information Center (1345) operated by the Ministry of Justice. It serves as a window for information on immigration counseling and information on life in 20 languages that foreigners need to adjust to life in Korea.
In addition, the Ministry of Gender Equality and Family operates the Danuri Call Center (1577-1366) in 13 languages to help marriage immigrants adapt to life in Korea. It also operates a 24-hour emergency support center for migrant women who are victims of violence."