Name,Script,name_vi,name_en,script_vi,script_en
,"저는 필리핀에서 온 레이나라고 합니다. 저는 고향에 있을 때 공무원이었습니다. 한국으로 여행을 왔다가 지금의 남편을 만나서 결혼을 했습니다. 남편이 저의 모국어를 잘하기 때문에 남편과는 큰 문제가 없습니다. 또 한국어를 잘 모르는 것치고 생활하는 데는 불편함이 없습니다. 하지만 남편의 가족들, 친구 등 다른 사람들과 의사소통이 잘 안 되어서 어려움이 많습니다. 한국어 실력이 부족하기 때문에 일을 하고 싶어도 일을 할 수가 없습니다. 아직 한국 국적이 없어서 2년마다 비자도 연장해야 합니다. 서류 준비는 복잡하고 힘듭니다. 수수료도 내야 하니까 부담스럽습니다. 그래서 저는 한국어를 빨리 배워서 국적을 취득하고 싶습니다. 그리고 고향에서처럼 공무원으로 취직도 하고 싶습니다. 좋은 방법이 없을까요?",,,"Tôi là Layna đến từ Philippines. Tôi đã từng là nhân viên nhà nước khi còn ở quê hương. Khi đến Hàn Quốc du lịch thì đã gặp và đã kết hôn với chồng hiện giờ. Chông tôi vì giỏi tiếng mẹ đẻ của tôi nên giữa tôi và chồng không có vấn đề gì lớn. Ngoài ra không có bất tiện gì trong sinh ngoại trừ việc chưa giỏi tiếng Hàn. Nhưng vì chưa thể giao tiếp tốt được với bên gia đình nhà chồng, bạn bè và những người khác nên cũng có nhiều khó khăn. Vì năng lực tiếng Hàn còn thiếu nên dù muốn đi làm cũng không thể đi làm được. Quốc tịch Hàn Quốc thì chưa có nên mỗi 2 năm lại phải đi gia hạn visa. Việc chuẩn bị giấy tờ thì phức tạp và mệt, phải trả phí nữa nên tôi thấy rất áp lực. Bởi vậy tôi muốn học tiếng Hàn thật nhanh rồi chuyển quốc tịch. Và tôi cũng muốn xin việc làm nhân viên nhà nước giống như ở quê hương. Không có biện pháp nào tốt không?","I'm Layna from Philippines. I was a government employee when I was in my homeland. When I came to Korea to travel, I met and married my current husband. My husband is good at my native language so there is no big problem between me and my husband. In addition, there is no inconvenience in birth except being not good at Korean. But because it is not possible to communicate well with the family of the husband's family, friends and others, there are many difficulties. Because Korean language skills are insufficient, even if you want to work, you cannot go to work. Korean nationals do not have, so every 2 years to extend the visa. The paperwork was complicated and tiring, and I had to pay the fee, so I felt pressure. So I want to learn Korean quickly and change my nationality. And I also want to apply for public employees as in my home country. Is there any good measure?"
체류 및 국적취득,"외국인이 대한민국에 체류를 하기 위해서는 먼저 외국인 등록을 신청해야 하고, 체류 대상과 목적에 따라서 체류 기간을 연장하거나 영주(F-5)자격 취득 및 국적 취득을 할 수 있다.
영주 자격을 취득하면 본인의 국적을 포기하지 않아도 되고, 출국한 날로부터 2년 이내에 재입국하고자 할 때에는 재입국허가를 받을 필요가 없다. 또한 영주 자격 취득 후 3년이 지나면 주소지의 지방선거에도 참여할 수가 있다.
국적을 취득하기 위해서는 지켜야 할 절차가 있는데 그 방법 중의 하나로 사회통합프로그램이 있다. 사회통합프로그램은 국내 이민자가 한국 사회의 건전한 구성원으로 적응·자립할 수 있도록 지원하기 위하여 법무부장관이 인정하는 소정의 교육과정(한국어 및 한국 사회 이해)을 이수한 이민자에게 국적취득과 체류 허가 등에서 이민정책 방향에 맞도록 편의를 제공하는 제도이다. 이 과정을 이수하면 국적취득절차 중에서 면접 심사를 면제받을 수 있다. 사회통합프로그램 운영기관은 사회통합정보망(www.socinet.go.kr) 전국 운영기관현황에서 확인할 수 있다.",Cư trú và nhập quốc tịch,Residence and nationality acquisition,"Người nước ngoài để cư trú ở Hàn Quốc trước tiên phải đăng ký thẻ người nước ngoài và tùy theo đối tượng và mục đích cư trú mà có thể kéo dài thời gian cư trú hoặc có được tư cách định cư (F-5) và nhập quốc tịch.
Khi đạt được tư cách định cư thì bản thân không cần từ bỏ quốc tịch của bản thân, và khi muốn nhập cảnh trở lại trong vòng 2 năm kể từ ngày xuất cảnh thì không cần phải xin giấy phép tái nhập cảnh. Ngoài ra sau 3 năm đạt được tư cách định cư thì có thể tham gia bầu cử ở địa phương nơi mình sinh sống (cư trú).
Để nhập quốc tịch thì có các thủ tục cần phải tuân theo. Một trong những phương pháp đó là chương trình hội nhập xã hội KIIP. Chương trình KIIP là chế độ tạo điều kiện để phù hợp với phương hướng chính sách di dân như cho phép cư trú vĩnh viễn và nhập quốc tịch cho người di trú đã hoàn thành quá trình giáo dục quy định được bộ Tư pháp công nhận (học tiếng Hàn và tìm hiểu về xã hội Hàn Quốc) để giúp cho người di trú trong nước có thể tự lập, thích ứng như một cấu thành khỏe mạnh của xã hội Hàn Quốc. Nếu hoàn thành quá trình này trong thủ tục nhập quốc tịch có thể được miễn phỏng vấn. Cơ quan điều hành chương trình này có thể xem xét ở trên trang thông tin xã hội tổng hợp (www.socinet.go.kr) trong phần Tổ chức điều hành quốc gia.","Foreigners to reside in Korea must first apply for an alien card and depending on the subject and purpose of their stay, may extend their stay or gain permanent residence status (F-5) and naturalization.
Once you have attained the status of residence, you do not need to give up your nationality, and when you want to re-enter within 2 years from the date of departure, you do not need to apply for a re-entry permit. In addition, after 3 years of attaining the status of residence, you can vote in the locality where you live (reside).
To acquire citizenship, there are procedures that need to be followed. One such method is the KIIP social integration program. KIIP is a regime that facilitates compliance with the direction of immigration policy such as allowing permanent residence and naturalization for immigrants who have completed the prescribed education process recognized by the Ministry of Justice ( learn Korean and learn about Korean society) to help the domestic immigrants to be independent and adapt as a healthy component of Korean society. If this process is completed in the naturalization procedure may be exempt from an interview. The executing agency for this program can be found on the integrated social information site (www.socinet.go.kr) in the 전국 운영 기관 현황 section."