Name,Example,Similar,Explaination_vi,Example_vi,Explaination_en,Example_en
N + (으)로 인해서,잦은 실수로 인해서 회사에서 신뢰를 잃었다.,,"""Vì/do...mà""
Thể hiện căn nguyên, nguyên nhân sâu xa của một trạng thái hay sự việc nào đó. Nó chủ yếu được dùng trong tin tức hay báo chí, là biểu hiện mang tính văn ngôn (thể văn viết). ",Anh ấy đánh mất sự tín nhiệm trong công ty bởi vì những lỗi lầm thường xuyên của anh ấy,"This expression is used to indicate the cause or reason for some situation or state of affairs. It is often used in formal situations, including written language, news reports, and presentations. The form (으)로 인해서 can be used without 서 and the form (으)로 인하여 is also used.",He lost credibility at the company due to his frequent mistakes.
V/A + (으)ㄹ 뿐 아니라,"가: 양강 씨는 버스보다 지하철을 자주 타나 봐요.
나: 지하철은 시간을 정확하게 지켜줄 뿐 아니라 편리해서 자주 이용합니 다.",[동사/황용사] + (으)ㄴ/는 데다가,"""Không những... mà còn""","가: Yang Gang, hình như bạn hay đi tàu điện ngầm hơn là xe bus nhỉ
나: Tàu điện ngầm không những chạy với thời gian cố định mà còn tiện lợi hơn, vì vậy tôi sử dụng nó","This expression is used to indicate that “not only what is stated in the preceding clause, but also what is stated in the following clause”. This expression can also be used without 만 as in -(으)ㄹ 뿐 아니라.","가: Yang Gang, It seems you take the subway more than the bus,
나: The subway not only runs on a more precise time schedule, but it’s also more convenient, so that's why I use it."