Name,Script,name_vi,name_en,script_vi,script_en
한국의 결혼 풍습,"두 사람이 결혼하기로 했으면 두 집안의 부모님을 모시고 상견례를 합니다. 부모님의 결혼 허락을 받고 본격적으로 결혼 준비를 하게 됩니다. 보통 신부 집에서 결혼 날짜를 잡습니다. 함께 살 신혼집은 신랑이 구하고 신부는 예단과 혼수를 준비합니다. 결혼식장도 잡고 시계나 반지, 목걸이 등 신랑과 신부를 위한 예물도 준비하고 청첩장도 돌리는 등 결혼식 전에 할 일이 아주 많습니다.
결혼식이 다가오면 신랑 집에서 신부 집으로 함을 보냅니다. 함 속에는 신부를 위한 예물, 옷감 등이 들어 있습니다. 결혼식에는 많은 하객들이 와서 결혼을 축하해 줍니다. 하객들은 축하의 뜻으로 보통 축의금을 냅니다. 결혼식이 끝나면 신부는 신랑과 함께 시댁 식구들에게 폐백을 드립니다. 이때 시부모님은 아이를 많이 낳고 잘 살라는 의미로 대추, 밤 등을 신부 치마에 던져 줍니다. 그 후 하객들을 위한 피로연을 하고 신랑과 신부는 신혼여행을 떠납니다.",Phong tục kết hôn của Hàn Quốc,Korean wedding customs,"Hai người nếu quyết định kết hôn thì sẽ gặp gỡ bố mẹ hai bên và làm lễ ra mắt. Nhận được sự đồng ý của bố mẹ thì sẽ chính thức chuẩn bị kết hôn. Thường thì phía nhà cô dâu chọn ngày cưới. Chú rể sẽ tìm ngôi nhà tân hôn cùng nhau chung sống và cô dâu thì chuẩn bị lễ vật (quà cưới của cô dâu cho nhà chồng) và của hồi môn (các vật phẩm cần thiết cho cuộc sống hôn nhân). Trước khi cưới có rất nhiều việc phải làm như là chọn nhà hàng tiệc cưới, chuẩn bị các sính lễ cho cả cô dâu và chú rể như vòng đồng hồ, nhẫn, vòng cổ rồi đi gửi thiệp mời cưới.

Gần đến ngày đám cưới thì sẽ gửi hòm từ nhà chú rể tới nhà cô dâu. Trong hòm có lễ vật, vải vóc dành cho cô dâu. Tại tiệc cưới có nhiều khách đến chúc mừng đám cưới. Các khách mời thường gởi tiền mừng với ý nghĩa chúc phúc. Khi tiệc cưới kết thúc thì cô dâu cùng với chú rể thực hiện nghi lễ 폐백 gia đình chồng. Lúc này bố mẹ chồng ném vào váy cô dâu táo tàu, hạt dẻ với ý nghĩa hãy sống tốt và có nhiều con cái. Sau đó là tổ chức tiệc mừng cho khách mời và cô dâu cùng chú rể sẽ đi trăng mật.","If the couple decides to get married, they will meet their parents and make a ceremony for the debut. With the consent of parents, they will officially prepare the marriage. Usually the bride's side chooses the wedding day. The groom will find a wedding house to live with and the bride will prepare gifts (bride's wedding gift for her husband's family) and dowry (necessary items for marriage). Before the wedding, there are many things to do such as choosing a wedding restaurant, preparing the ceremony for both the bride and groom such as watch rings, rings, necklaces and sending out wedding invitations.

Near the wedding day, the crate will be sent from the groom's house to the bride's house. There is an offering in the chest, cloth for the bride. At the wedding reception, many guests came to celebrate the wedding. The guests often send money with the meaning of blessing. At the end of the wedding party, the bride and the groom perform the ritual chồng of the husband's family. At this time, the parents-in-law threw a chestnut and chestnut bridal dress with the meaning of living well and having many children. Then there is a party for the guests and the bride and groom will go honeymoon."
한국의 전통 결혼식,"전통 결혼식에는 주례가 없고, 결혼 절차를 진행 하는 사회자만 있다. 신랑과 신부는 혼례상을 마주 보고 서로 절을 하고 술을 나눠 마시며 끝까지 함께할 것을 약속한다.
혼례상 위에는 대추와 밤, 소나무, 대나무, 기러기, 암탉과 수탉 등이 있다. 이러한 것들은 모두 특별한 의미를 가지고 있다. 예를 들면, 기러기는 사이좋은 부부 관계를 나타내고 대추와 밤은 많은 자녀를 상징한다.
신부는 아름다운 예복을 입고 족두리를 머리에 쓴다. 붉은색이 나쁜 것을 막아준다고 믿기 때문에 두 볼에는 연지, 이마에는 곤지를 찍는다.",Lễ cưới truyền thống Hàn Quốc,Korean traditional wedding,"Trong đám cưới truyền thống ở Hàn Quốc, không có chủ hôn mà chỉ có người dẫn chương trình, người tiến hành các trình tự trong lễ cưới. Chú rể và cô dâu nhìn đối diện vào bàn thờ hôn lễ, bái lạy lẫn nhau và chia nhau cùng uống ly rượu với ý nghĩa hẹn ước sẽ sống bên nhau trọn đời.
Trên bàn thờ làm lễ gồm có táo, hạt dẻ, cây thông, cây tre, ngỗng đực, gà trống và gà mái…Những thứ này, tất cả đều mang theo ý nghĩa đặc biệt. Lấy ví dụ như ngỗng đực biểu thị cho quan hệ vợ chồng thuận hòa còn táo và hạt dẻ tượng trưng cho con đàn cháu đống (con cái đông vui)
Cô dâu mặc lễ phục thật đẹp và đội chokturi trên đầu. Vì tin rằng màu đỏ rực giúp che chở, ngăn chặn những điều không hay, điều xấu (trong cuộc sống) nên cô dâu được đánh phấn hồng lên hai má và chấm một vết son đỏ lên trán.","In traditional weddings in Korea, there is no host, only the host, who processes the wedding ceremony. The groom and the bride look opposite to the marriage altar, bowing to each other and sharing a glass of wine with the meaning of promising to live together forever.
On the altar of the ceremony were apples, chestnuts, pine trees, bamboo trees, male geese, roosters and hens ... These all had special meanings. For example, the male goose represents a harmonious relationship and the apple and the chestnuts represent the descendants (crowded children).
The bride wore a beautiful dress and a chokturi on her head. Believing that the bright red helps protect and prevent bad things (in life), the bride is blushed on her cheeks and put a red lipstick on her forehead."