Name,Script,name_vi,name_en,script_vi,script_en
"한국인, 인터넷 어떻게 사용하고 있나","“김민준 씨(36세)는 일어나자마자 컴퓨터를 켜고 이메일을 확인한다. 지하철 안에서는 스마트폰으로 뉴스를 보거나 어제 놓친 드라마를 내려 받아 본다. 산책 중에 발견한 예쁜 풍경을 사진 찍어 블로그에 올리고, 집에 와서는 인터넷에서 아이가 사 달라고 한 자전거를 검색해 가장 싼 쇼핑몰에 가서 주문을 한다. 그리고 인터넷 뱅킹으로 고향에 돈을 보내고, 외국으로 유학 간 친구에게 인터넷 전화를 건다. 인터넷 화상 전화는 얼굴 보면서 이야기할 수 있고, 아무리 오래 통화를 해도 무료라서 좋다. 통화를 끝낸 후 침대에 누워 스마트폰으로 SNS에 올라온 친구들의 소식을 확인하고 잠이 든다.”
이 이야기는 한국 사람들의 하루를 써 본 것이다. 이처럼 요즘은 일어나서 잘 때까지 인터넷과
함께하고 있다. 그러면 한국 사람들은 인터넷으로 무슨 일을 가장 많이 할까? 100명에게
질문했는데, 인터넷으로 정보 검색을 가장 많이 한다고 했으며, 그 다음은 뉴스와 신문 보기, 이메일 확인, 인터넷 쇼핑 등을 한다고 말했다.","Người Hàn Quốc, đang sử dụng mạng xã hội như thế nào?",,"“김민준 (36 tuổi) ngay sau khi thức dậy thì bật máy tính và xem thư điện tử. Ở trong tàu điện ngầm anh xem tin tức bằng điện thoại hoặc tải bộ phim đã bỏ lỡ hôm qua. Trong lúc đi dạo phát hiện cảnh đẹp thì chụp rồi đăng lên blog. Về đến nhà anh lên mạng tìm kiếm một chiếc xe đạp mà con đòi mua rồi đến khu mua sắm rẻ nhất để đặt hàng. Tiếp đó anh gửi tiền về quê qua internet banking, gọi điện thoại qua mạng cho bạn đi du học ở nước ngoài. Điện thoại video qua mạng vừa nhìn thấy mặt vừa có thể nói chuyện và dù cho nói bao nhiêu lâu đi nữa cũng không mất phí nên rất thích. Sau khi kết thúc cuộc điện thoại, anh nằm lên giường xem tin tức bạn bè đăng lên mạng xã hội (SNS) bằng điện thoại rồi ngủ.
Đây là câu chuyện viết về một ngày của người Hàn Quốc. Thời gian gần đây, từ khi thức dậy cho đến lúc ngủ mạng internet luôn ở bên cạnh họ như thế này. Vậy thì người Hàn Quốc sử dụng internet vào việc gì nhiều nhất nhỉ? Hỏi đáp 100 người đã cho thấy nhiều nhất là tìm kiếm thông tin bằng internet, sau đó là đọc báo, xem tin tức, xác nhận mail, mua sắm…",
한국의 대표직인 포털 사이트 (portal site),"포털 포털 사이트는 인터넷으로 들어가는 문과 같은 역할을 하며, 검색 서비스와 이메일 서비스는 물론 뉴스, 쇼핑, 블로그. 사전, 지도 등 다양한 서비스를 제공한다. 그렇다면 한국의 대표적인 포털 사이트는 어디일까?
Naver:
한국 사람들이 가장 많이 사용하는 포털 사이트로, 정보 검색이 편리하다. 그리고 ‘블로그’와 이용자들이 궁금한 것을 직접 묻고 답하는 ‘지식in 서비스’로 유명하다.
Daum:
한국에서 두 번째로 사용자가 많은 포털 사이트로, 인터넷 동호회인 ‘카페’ 서비스로 유명하며, 뉴스 서비스와 동영상 서비스가 강점이다.
Nate:
한국 최초의 SNS인 ‘싸이월드’와 ‘네이트온’이라는 인터넷 채팅 서비스로 유명하다. 젊은 세대가 좋아할 만한 재미있는 읽을거리와 볼거리가 많다.",Cổng thông tin điện tử nổi tiếng của Hàn Quốc,,"Portal site (Cổng thông tin điện tử) có vai trò giống như cánh cửa đi vào mạng thông tin, được cung cấp đa dạng như dịch vụ tìm kiếm, hòm thư điện tử, ngoài ra còn có tin tức, mua sắm, blog, từ điển, bản đồ… Vậy portal site tiêu biểu của Hàn quốc là gì?
Naver:
Vì là portal site người Hàn sử dụng nhiều nhất nên tìm kiếm thông tin khá dễ dàng. Và còn có trang blog và “dịch vụ tri thức” người sử dụng hỏi đáp trực tiếp những gì tò mò.
Daum:
Portal site thứ 2 được sử dụng nhiều ở Hàn có tiếng đó là dịch vụ hội cùng sở thích qua mạng “cafe” và dịch vụ tin tức, video là điểm mạnh.
Nate:
‘싸이월드-cyworld’ và ‘네이트온-NateOn’ là SNS đầu tiên của Hàn Quốc, nổi tiếng với dịch vụ chatting internet. Có nhiều thứ thú vị để đọc và để xem đáng để giới trẻ yêu thích.",
