Name,Script,name_vi,name_en,script_vi,script_en
한국의 학교 교육 과정,"한국에서는 보통 8살(만 6살)에 초등학교에 입학합니다. 한국은 3월에 새 학년이 시작되기 때문에 입학식도 3월에 있습니다. 입학을 하면 초등학교 1학년이 되어 학교 공부를 시작합니다. 한국은 한 학년이 2개의 학기로 되어 있으며 1학기는 3월에, 2학기는 9월에 시작됩니다. 그리고 학기 사이사이에 여름 방학(7~8월)과 겨울 방학(12~2월)이 있습니다. 초등학교를 6년 다닌 후에는 중학교에서 3년을 공부합니다. 초등학교부터 중학교까지는 의무 교육이기 때문에 한국 사람이라면 누구나 등록금 없이 공부할 수 있습니다. 고등학교는 3년 과정으로 대학 진학을 위한 일반계(인문계) 고등학교와 직업 교육을 받을 수 있는 전문계 고등학교, 그리고 특기와 소질을 살릴 수 있는 특수목적고등학교(외국어고등학교 및 예술고등학교) 등 여러 종류가 있습니다. 고등학교 3학년 학생들은 11월에 ‘대학수학능력시험(수능)’을 치르는데, 대학교에 가기 위해서는 수능 시험 성적이 중요하기 때문에 학생들은 고등학교에 다니는 동안 이 시험을 매우 열심히 준비합니다. 고등학교 졸업 후, 계속 공부하고 싶은 학생들은 대학교에 가는데, 교육열이 높은 한국에서는 고등학교 졸업생 중 80%가 대학교에 진학하고 있습니다. ",Quá trình giáo dục tại Hàn Quốc,,"Ở Hàn Quốc, thông thường 8 tuổi (tuổi Hàn) (bằng 6 tuổi thông thường) bắt đầu vào học trường tiểu học . Vì vào tháng 3 năm học mới sẽ được bắt đầu nên lễ khai giảng cũng vào tháng 3. Khi nhập học, sẽ bắt đầu học tập được tính là năm học 1 cấp tiểu học. Hàn Quốc một năm học có hai học kỳ, một học kỳ bắt đầu vào tháng 3, và học kỳ thứ hai bắt đầu vào tháng 9. Và ở khoảng giữa các học kỳ có kỳ nghỉ hè (tháng 7 đến tháng 8) và kỳ nghỉ mùa đông (tháng 12 đến tháng 2). Sau khi theo học tiểu học trong 6 năm, sẽ học tiếp 3 năm ở trường trung học cơ sở. Từ cấp tiểu học đến THCS là giáo dục bắt buộc nên cứ là người Hàn Quốc thì bất cứ ai có thể học mà không cần học phí. Trường trung học phổ thông(THPT) học kéo dài ba năm để học lên đại học và có nhiều chủng loại khác nhau như trường THPT thông thường (khối nhân văn) và trường trung học chuyên nghiệp dạy nghề mà có thể nhận đào tạo nghề, ngoài ra còn có trường trung học phổ thông chuyên biệt (trường THPT tiếng nước ngoài và trường trung học nghệ thuật) mà ở đó có thể giúp phát triển các tố chất và tài năng đặc biệt. Các học sinh năm 3 THPT sẽ thi “kỳ thi năng lực đầu vào(tuyển sinh) đại học” vào tháng 11. Để vào được đại học thì kết quả của kỳ thi tuyển sinh đại học rất quan trọng nên trong thời gian học cấp 3, các bạn học sinh rất chăm chỉ chuẩn bị cho nó. Sau khi tốt nghiệp THPT, những học sinh muốn tiếp tục học sẽ vào đại học, vì nhiệt huyết giáo dục ở Hàn Quốc rất cao nên có tới 80% học sinh tốt nghiệp trung học đang học tiếp lên đại học.",
한국의 교육열과 사교육,"한국 학생들의 대학교 진학률은 OECD 회원국 중에서 가장 높다. 이런 뜨거운 교육열은 자원이 부족한 한국이 빠르게 경제 성장을 할 수 있도록 도운 원동력이었다. 교육열 덕분에 실력 있는 인재들을 키울 수 있었던 것이다.
그렇지만 한편으로 이런 교육열 때문에 여러 문제도 나타나고 있다. 자신의 아이가 다른 아이들보다 뒤떨어지지 않도록 더 많이, 더 빨리 가르치고 싶어 하는 부모들의 욕심 때문에 학교 밖에서의 교육, 즉사교육이 지나치게 유행하고 있는 것이다.
교실에서 여러 학생을 대상으로 수업을 하는 학원, 그리고 1~3명 정도의 학생이 소규모로 수업이 받는 과외, 영어를 배우기 위해 외국으로 나가는 어학연수 등이 대표적인 사교육 유형으로, 한국의 부모들은 자녀의 사교육비로 매달 많은 돈을 지출하고 있다. 
이런 사교육비 부담이 점점 커지면서 한국 정부는 학교에서 ‘방과후학교’를 운영하도록 하고 있으며, 학생이 사교육을 받지 않아도 대학 입시를 잘 준비할 수 있도록 EBS 수능강의를 강화하는 등 사교육을 줄이기 위해 많은 노력을 기울이고 있다.",Giáo dục tư nhân và sự hiếu học ở Hàn Quốc,,"Tỷ lệ học sinh Hàn Quốc vào đại học là cao nhất trong số các nước thành viên OECD. Sự hiếu học mãnh liệt này đối với giáo dục đã là động lực thúc đẩy tăng trưởng kinh tế nhanh chóng của Hàn Quốc. Nhờ sức nóng của nền giáo dục mà đã có thể nuôi dưỡng (nâng cao) những nhân tài có năng lực.
Mặt khác, vì sự hiếu học này mà có nhiều vấn đề khác nảy sinh. Để con cái của mình không tụt hậu so với những đứa trẻ khác,vì mong muốn(lòng tham) của cha mẹ muốn dạy nhiều hơn, nhanh hơn cho con cái nên học thêm bên ngoài, học tư nhân ngày càng trở nên phổ biến.
Loại hình giáo dục tư nhân tiêu biểu là các trung tâm (học viện) mở các lớp học với nhiều học sinh cùng học, và các lớp ngoại khóa quy mô nhỏ khoảng 1~3 em học sinh chủ yếu nghiên cứu ngữ học ra nước ngoài để học tiếng Anh, các bậc cha mẹ Hàn Quốc đang phải chi trả rất nhiều tiền hàng tháng cho phí học tư nhân của con em mình.
Vì gánh nặng chi phí giáo dục tư nhân ngày càng gia tăng, chính phủ Hàn Quốc đang chạy chương trình ‘sau giờ học’ ở trường và đang nỗ lực để giảm bớt giáo dục tư nhân bằng cách tăng cường các bài giảng luyện thi trên EBS để học sinh có thể chuẩn bị tốt cho kỳ thi tuyển sinh đại học mà không cần có học thêm bên ngoài.",
