Name,Example,Similar,Explaination_vi,Example_vi,Explaination_en,Example_en
V + (으)ㄹ 겸,한국말도 배울 겸 친척들도 만날 겸 해서 왔습니다.,,"""Để....và cũng để.../ vừa để...vừa để.../ để vừa...vừa.../ để...cũng như.../kiêm, đồng thời""
Được sử dụng khi bạn muốn nói về một hành động có hai hay nhiều mục đích, bạn có thể liệt kê
chúng ra khi sử dụng -(으)ㄹ 겸",Tôi tới Hàn Quốc để học tiếng Hàn và cũng để gặp người thân.,"Used to show two different things that occured in the same place
'To do A and B, I did/went...'",I came here to learn Korean and to meet my relatives.
N + (이)라도,"가: 회사 일이 바쁜데 이번 여름에 휴가를 갈 수 있을까요?
나: 길게 시간이 안 되면 1박 2일이라도 갑시다.",,"""dù không thích nhưng mà..."", ""dù là...cũng hãy làm""

Cái gì đó được đề xuất nhưng không phải là tốt nhất trong các lựa chọn, chỉ tạm hài lòng.(thể hiện một sự lựa chọn tối thiểu hoặc là dù không thích nhưng không còn giải pháp nào khác.","가: Dù công việc bận rộn, bạn sẽ đi nghỉ vào mùa hè này chứ?
나: Tôi không có nhiều thời gian thế nên tôi chỉ có thể đi 1 đêm 2 ngày.",For when a noun is the second best or less preferred option.,"가: Although work is busy will you take a vacation this summer?
나: I don't have a long time so I can only go for 1 night and 2 days."