Name,Example,Similar,Explaination_vi,Example_vi,Explaination_en,Example_en
A/V + 다고 하다,한상호 과장이 축구 동호회 회원을 모집한다고 했어요.,,"""Đã bảo là…"" 
Sử dụng khi truyền đạt lại lời nói trần thuật của người nào đó (tường thuật gián tiếp một nội dung được nghe từ người khác). Người nói cũng sử dụng khi truyền đạt lại lời nói của bản thân.",Trưởng phòng Hansangho đã nói rằng đội bóng công ty đang tuyển thêm người,This is used for reported speech.,(Manager) Hansangho (said) that the company football team is recruiting.
A/V + 냐고 하다,사장님이 저에게 언제 한국에 왔냐고 물어봤어요.,,"""Hỏi là, hỏi rằng..."" 
Được dùng khi tường thuật gián tiếp câu hỏi từ một người khác. Người nói cũng sử dụng khi truyền đạt lại lời nói của bản thân.",Sếp hỏi tôi đến Hàn Quốc từ khi nào,"Quoting a question.
Frequently used with '물어봤어요'.",My boss asked me when I came to Korea.