Name,Script,name_vi,name_en,script_vi,script_en
8.15 광복과 건국 준비,"한국은 1910년 일본에 주권을 빼앗겼지만 끊임 없이 독립을 위해 노력했다. 특히 1919년에는 전국적으로 3.1 운동을 벌였고, 이후 대한민국 임시정부를 수립하고 무장투쟁을 전개하였다. 결국 1945년 8월 15일 일본의 항복과 함께 한국은 광복을 맞이하게 되었다.
광복 이후 한국에서는 새로운 나라를 세우기 위한 노력이 이어졌다. 우리 국민 스스로 각 지역의 치안과 행정을 담당하고자 노력 했고, 이승만과 김구 등 해외에서 활동하던 독립 운동가들이 국내로 돌아오면서 새 나라 건설을 위해 힘을 모았다. 이 과정에서 새로운 나라를 어떻게 만들어갈 것인가를 두고 여러 정치 세력들이 다양한 주장을 펼치면서 경쟁하고 갈등하는 모습이 나타 났다.
한편, 광복 직후 한반도의 안정을 목적으로 위도 38도선 을 기준으로 북쪽에는 소련군이, 남쪽에는 미군이 들어 왔다. 특히 미국, 영국, 소련의 대표들이 모인 회의 (모스크바 3국 외상 회의)에서 한반도에 임시정부를 수립하고 최고 5년 동안 신탁 통치를 실시하기로 결정 했다. 하지만 즉시 독립하기를 원했던 사람들은 강하게 저항했고, 신탁통치 찬반을 둘러싼 갈등이 심해졌다. 결국 신탁 통치는 이뤄지지 않았지만 한반도는 소련과 미국의 영향을 강하게 받게 되었다.",Giải phóng 15.8 và chuẩn bị thành lập chính phủ.,Liberate 15.8 and prepare to form the government.,"Hàn quốc mất chủ quyền cho Nhật bản vào năm 1910 nhưng vẫn cố gắng đấu tranh để dành được độc lập. Ðặc biệt người hàn quốc triển khai phong trào độc lập vào ngày 1 tháng 3 năm 1919 trên toàn quốc và sau đó thành lập chính phủ lâm thời đại hàn dân quốc và triển khai đấu tranh vũ trang. Cuối cùng vào ngày 15 tháng 8 năm 1945 với sự đầu hàng của nhật bản, hàn quốc giành độc lập. 
Sau khi giải phóng, ở hàn quốc có nhiều cuộc vận động để xây dựng đất nước mới. nhân dân hàn quốc cố gắng tự phụ trách trị an và chính sách của từng địa phương. Những nhà vận động phong trào độc lập ở hải ngoại như Lee seung man – Kim Koo.. về nước. Họ hợp tác với nhau để xây dựng đất nước mới nhưng trong quá trình đó, nhiều thế lực chính trị đề xuất, nhiều hình mẫu quốc gia đa dạng và cũng có xảy ra nhiều mâu thuẫn. 
Còn sau giải phóng, để ổn định bán đảo triều tiên theo tiêu chuẩn là vĩ tuyến 38 quân đội Liên xô tiến vào phía bắc và quân đội Mỹ tiến vào phía nam. Ðặc biệt hội nghị Moscow với sự tham gia của các bộ trưởng, ngoại giao Mỹ, Liên xô và Anh quyết định thành lập chính phủ lâm thời ở bán đảo Triều tiên và thực hiện ủy trị tối đa 5 năm nhưng trong những người muốn độc lập ngay lập tức phản đối quyết liệt và mâu thuẫn về vấn đề ủy trị trở nên nghiêm trọng hơn. Cuối cùng ủy trị không được thực hiện nhưng bán đảo Triều tiên vẫn chịu ảnh hưởng mạnh mẽ của Mỹ và Liên xô. ","Korea lost sovereignty to Japan in 1910 but still struggled to gain independence. In particular, Koreans launched the independence movement on March 1, 1919 nationwide and then established the interim Korean government and launched armed struggle. Finally on August 15, 1945 with the surrender of Japan, Korea gained independence.
After liberation, there were many campaigns in Korea to build a new country. Korean people try to take care of the security and policies of each locality. Independent independence movement activists such as Lee seung man - Kim Koo .. returned home. They work together to build a new country, but in the process, many political forces propose, many national models are diverse and there are also many conflicts.
And after liberation, to stabilize the Korean peninsula according to standards, the 38th parallel of the Soviet army entered the north and the US army entered the south. In particular, the Moscow conference, with the participation of US, Soviet and British ministers, diplomats, decided to form a provisional government in the Korean peninsula and carry out a trusteeship
for up to 5 years but among those who want to be independent immediately set up a strong opposition and the conflict over the trusteeship over the matter became more serious. Eventually the trusteeship was not carried out but the Korean peninsula remained strongly influenced by the United States and the Soviet Union."
대한민국 임시정부,"3.1 운동 이후 한국인들은 중국 상하이에 대한민국 임시정부를 수립하여 더욱 조직적 | 으로 국내외 독립운동을 이끌었다. 임시정부 내에서 이승만은 강대국과의 외교에 힘을 | 쏟았고, 안창호는 독립신문을 발행했다. 김구는 한국광복군을 만들었고, 대한민국 건국 강령을 발표하기도 했다. 현재 대한민국 헌법 전문에는 대한민국 임시정부의 정신이 다음과 같이 반영되어 있다. “유구한 역사와 전통에 빛나는 우리 대한국민은 3·1운동으로 건립된 대한민국 임시 정부의 법통과, 불의에 항거한 4·19민주이념을 계승하고~""",Chính phủ lâm thời của Hàn Quốc,Provisional Government of Korea,"Sau phong trào độc lập 1.3 người hàn quốc thành lập chính phủ lâm thời Hàn quốc tại Thượng hải và xúc tiến phong trào độc lập trong và ngoài nước một cách có tổ chức. ở chính phủ lâm thời Lee seung man tập trung giao kết với các cường quốc, Ahn chang Ho phát hành báo độc lập. Kim Koo tổ chức quân đội giải phóng hàn quốc và ban hành cương lĩnh kiến quốc. Hiện nay tinh thần chính phủ lâm thời hàn quốc được phản ánh trong phần mở đầu của hiến pháp hàn quốc. Lời mở đầu của hiến pháp đại hàn dân quốc “chúng ta, người dân hàn quốc, tự hào về lịch sử và truyền thống sang chói từ xa xưa. Giữ gìn sự nghiệp của chính phủ cộng hòa hàn quốc lâm thời, ra đời từ phong trào độc lập 1.3 năm 1919 và lý tưởng dân chủ của cuộc khởi nghĩa 19.4 năm 1960 chống lại sự bất công, gánh vác nhiệm vụ cải cách dân chủ và thống nhất hòa bình tổ quốc ta”","After the independence movement 1.3 Koreans established the interim government of Korea in Shanghai and promoted the independence movement at home and abroad in an organized manner. In the interim government Lee Seung Man focused on engaging with powerful countries, Ahn Chang Ho published an independent newspaper. Kim Koo organized the Korean Liberation Army and promulgated a nationalist platform. The spirit of the Korean provisional government is now reflected in the beginning of the Korean constitution. Preamble to the Republic of Korea Constitution ""We, the people of Korea, are proud of our history and traditions from ancient times. Preserving the career of the provisional republic of the Republic of Korea, born from the 1.3 independence movement in 1919 and the democratic ideals of the 19.4 revolt in 1960 against injustice, taking on the task of democratic reform and unify our country peace ”"
대한민국 정부 수립의 과정,"미국과 소련은 각기 자기 나라에 우호적인 정부를 한반도에 수립하고자 대립했고, 이 과정에서 한반도가 남과 북으로 분단될 가능성이 커졌다. 그래서 김구, 김규식 등은 통일된 정부를 세우기 위해 노력했지만, 남과 북의 견해 차이는 좁혀지지 않았고 이념의 대립도 더욱 심해졌다.
이런 상황에서 UN은 한반도에서 총선거를 실시하기로 결정했다. 하지만 북한이 이를 거부하면서 남한만의 총선거가 실시되었다. (1948년 5월 10일). 이 과정에서 통일 정부가 아니라 남한만의 단독 정부가 수립되는 것을 반대하는 이들을 중심으로 여러 가지 갈등이 나타났다. 특히 제주도에서는 남한만의 단독 선거에 반대하는 무장 봉기가 일어났고, 이를 진압하는 과정에서 많은 민간인들이 희생되기도 했다(제주 4.3 사건). 이런 여러 아픔을 딛고 총선거에 의해 선출된 대표들은 새로운 나라를 위한 헌법을 제정 하였다(1948년 7월 17일, 제헌절). 그리고 이 헌법에 따라 실시된 대통령 선거 에서 이승만이 대한민국의 초대 대통령으로 선출되었다. 이승만 대통령은 정부를 구성하고 대한민국 정부 수립을 국내외에 선포하였다. (1948년 8월 15일).",Quá trình thành lập chính phủ hàn quốc. ,Korean Government Establishment Process,"Mỹ và Liên xô đối lập với nhau để xây dựng một chính phủ có thái độ thân thiện với mình. Trong quá trình đó, khả năng bán đảo Triều tiên bị chia cách dần dần tăng lên. Vì vậy những người như Kim Koo, Kim Kyu shik... cố gắng để thành lập một chính phủ thống nhất như sự khác biệt trong ý kiến của Nam bắc không được thống nhất và sự đối lập tư tưởng càng trở nên nghiêm trọng. 
Trong bối cảnh đó, UN quyết định thực hiện bầu cử ở bán đảo Triều tiên nhưng Bắc triều tiên từ chối tổng bầu cử nên chỉ Hàn quốc (nam triều tiên) tiến hành tổng bầu cử vào ngày 10.5.1948 . Trong quá trình đó nhiều người phản đối thành lập chính phủ riêng biệt của hàn quốc chứ không phải là chính phủ thống nhất, sự mâu thuẫn đã xuất hiện. Ðặc biệt trên đảo jeju khởi nghĩa vũ trang phản đổi bầu cử riêng của nam triều tiên và trong quá trình đàn áp khởi nghĩa này nhiều người đã hy sinh. 
Những người đại diện được đắc cử trong tổng bầu cử chấp nhận nổi đau này và ban hành hiến pháp cho quốc gia mới. trong bầu cử tổng thống căn cứ vào hiến pháp Lee seung Man đã đắc cử tổng thống đầu tiên của đại hàn dân quốc. tổng thống Lee seung Man thành lập chính phủ mới và tuyên bố sự thành lập chính phủ hàn quốc trong và ngoài nước.","The United States and the Soviet Union oppose each other to build a friendly government with them. In the process, the likelihood of a divided Korean peninsula gradually increased. So people like Kim Koo, Kim Kyu Shik ... try to form a unified government as the differences in the opinions of the North and South are not united and the opposing ideas become more serious.
In this context, the UN decided to conduct elections on the Korean peninsula but the North rejected the general election, so only Korea (the South Korea) conducted the general election on October 10, 1948. In the process, many opposed the creation of a separate Korean government rather than a united government, a conflict arose. Particularly, on JeJu island, the armed uprising reflected the election of South Korea and many people died in the process of suppressing this uprising.
The elected representatives in the general election accept this pain and enact the constitution for the new country. In the presidential election based on the constitution Lee seung Man was elected the first president of the Republic of Korea. President Lee Seung Man established a new government and announced the establishment of the Korean government at home and abroad."