Name,Script,name_vi,name_en,script_vi,script_en
4.19 혁명과 유신 반대,"대한민국의 초대 대통령 이승만은 1948년 정부 수립 이후 12년 동안 세 차례에 걸쳐 대통령을 맡았다. 그는 6.25전쟁 등 어려운 시기에 한국 정치를 이끌었지만 1960년 선거 과정에서 부정이 드러나면서 시민들의 저항에 부딪쳤다. 특히 대학생은 물론 중고등 학생들까지 부정 선거에 항의하는 시위가 전국적으로 확대되었고, 이 시위를 진압 하는 과정에서 많은 사람들이 희생되었다. 결국 이승만 대통령은 국민들의 요구를 받아들여 대통령직에서 물러났다(4.19 혁명, 1960년). 4.19 혁명 이후 민주화에 대한 다양한 주장이 쏟아지는 가운데 1961년 박정희를 비롯한 군인들은 무력으로 정권을 장악했고(5.16 군사 정변), 이후 대통령이 되었다. 박정희 대통령 은 경제 개발과 안보를 최우선적으로 강조했고, 1972년 헌법 개정을 통해 대통령의 권한을 더욱 강화했다(10월 유신), 하지만 이런 과정에서 민주주의의 후퇴를 염려한 시민들의 저항이 늘어났다. 특히 부산과 마산에서는 많은 시민들이 시위에 참여하여 정부와 충돌하기도 하였다 (부마 민주 항쟁). 이러한 혼란 속에서 1979년 박정희 대통령이 암살당하면서 유신 체제는 막을 내렸다(10.26 사태).",Cách mạng 19.4 và phản đối hệ thống phục hồi,Revolution 19.4 and protest restoration system,"Tổng thống đầu tiên của hàn quốc Lee Seung Man đã làm tổng thống 3 nhiệm kỳ liên tiếp suốt 12 năm từ khi chính phủ thành lập đầu năm 1948. Ông dẫn dắt Hàn quốc vượt qua các giai đoạn khó khăn như chiến tranh Triều tiên nhưng khi sai trái của ông trong bầu cử của ông năm 1960 bị đưa ra ánh sang, người dân hàn quốc đã biểu tình. Sinh viên đại học và học sinh trung học đặc biệt tham gia biểu tình chống lại gian lận bầu cử lan khắp đất nước. trong quá trình đàn áp các cuộc biểu tình nhiều người đã hy sinh. Cựu tổng thống Lee đã chấp thuận yêu cầu của người dân và từ chức vào ngày 19.4.1960 . 
Trong khi nhiều cuộc tranh luận được gợi ra về vấn đề dân chủ hóa sau cách mạng 19.4 Park chung Hee và quân đội đã giành quyền lực trong 1 cuộc đảo chính năm 1961, sau cuộc đảo chính tổng thống Park chung Hee nhấn mạnh nhu cầu cần thiết và ưu tiên phát triển kinh tế cùng an ninh, quyền lực của tổng thống được củng cố qua lần sửa đổi hiến pháp năm 1972. 
Tuy nhiên, người dân hàn quốc biểu tình nhiều hơn, trong quá trình đó vì lo sợ nên dân chủ thụt lùi, nhiều người đặc biệt người ở Busan và Masan đã tham gia biểu tình và xung đột với cơ quan chính phủ. Giữa xã hội hỗn loạn như thế, Tổng thống Park Chung-hee đã bị ám sát năm 1979, chấm dứt Hệ thống Phục hồi (10.26). ","South Korea's first president Lee Seung Man has served as president for three consecutive terms during the 12 years since the government's establishment in early 1948. He led Korea through difficult periods like the Korean War but When his wrongdoings in the 1960 election were brought to light, the Korean people protested. College students and high school students specifically participated in protests against electoral fraud spread across the country. In the process of suppressing the protests many people have died. Former President Lee accepted people's requests and resigned on April 19, 1960.
While many debates were raised about democratization after the 19.4 Park Chung Hee revolution and the army seized power in a coup in 1961, after the coup President Park Chung Hee emphasized the necessary and prioritized economic development and security, the president's power was strengthened through a constitutional amendment in 1972.
However, the Korean people protested more, in the process of fear of democracy regression, many people especially in Busan and Masan participated in protests and conflicts with government agencies. Amidst such chaotic society, President Park Chung-hee was assassinated in 1979, ending the Restoration System (10.26)."
한국의 민주화 운동을 이끌었던 학생들,대한민국의 민주화 운동에는 학생들이 참여하고 주도한 경우가 많다. 특히 4.19 혁명 에서는 전체 186명의 희생자 중 77명이 학생이었다. 당시 시위에는 대학생들은 물론 중학교나 고등학교에 다니는 학생들도 많이 참여하였다. 학생들의 이와 같은 적극적인 참여는 이후에 한국의 민주주의가 자리 잡고 국민의 자유와 권리를 보호하는 데 큰 역할을 했다.,Sinh viên dẫn đầu phong trào ủng hộ dân chủ ở Hàn quốc,Students lead the pro-democracy movement in Korea,"Thường xuyên nhất chính sinh viên là người dẫn dắt phong trào dân chủ ở hàn quốc. trong số tổng cộng 186 nạn nhân chết trong cuộc cách mạng 19.4, với 77 người là sinh viên, học sinh trung học lẫn sinh viên đại học đã tham gia biểu tình vào thời đó. Sự tham gia tích cực của họ đã đóng vai trò lớn trong việc thành lập nên dân chủ ở hàn quốc và bảo vệ tự do, quyền lợi của ngườ dân.","Most often it is the student who leads the democratic movement in Korea. of a total of 186 victims died during the 19.4 revolution, with 77 being students, high school students and university students participating in the protest at the time. Their active participation has played a big role in establishing democracy in Korea and protecting the freedom and interests of the people."
5.18 광주 민주화 운동과 6월 민주 항쟁,"10.26 사태로 혼란스러운 가운데 전두환, 노태우 등의 군인들은 병력을 동원해 정권을 장악하였다 (12.12 사태, 1979년), 이에 광주 시민들은 민주주의 실현을 요구하며 강력하게 저항했다. 전두환 등 군부 세력은 시위가 전국으로 확산되는 것을 우려 하여 군대를 투입했고 이로 인해 많은 사람들이 희생 되었다(5.18 광주 민주화 운동, 1980년). 이 사건 이후 전두환은 대통령으로 선출되었다.
전두환 대통령은 강력한 정책으로 사회 질서를 유지하고자 했는데 이 과정에서 민주 주의적 요구는 받아들여지기 어려웠다. 특히 1987년에는 국민들이 대통령 직선제를 요구했지만 전두환 정부는 이를 무시하자 전국적으로 시위가 확산되었다. 결국 정부는 국민의 요구를 수용하였고 대통령 직선제가 부활하였다(6월 민주 항쟁, 1987년).
1987년 개정된 헌법에 따라 대한민국의 민주주의는 서서히 발전해왔다. 1993년에는 김영삼이 대통령으로 당선되면서 군부 세력에 의한 정치가 끝났다. 또한 1997년 대통령 선거에서는 김대중 후보가 야당 출신으로는 처음으로 대통령에 당선되면서 평화적 정권 교체를 실현하였다. 2007년에는 다시 야당의 이명박 후보가 대통령이 되면서 정권이 다시 교체되었다. 이러한 과정을 통해 대한민국은 민주주의 국가로서 보다 안정된 모습을 갖추기 위해 노력하고 있다.",Phong trào dân chủ hóa gwangju ngày 18.5 và phong trào dân chủ tháng 6.,Gwangju democratization movement on May 18 and the democratic movement in June.,"Giữa sự bối rối sau sự việc ngày 26/10, các nhân vật quân đội như Chun Doo Han và Roh Tae woo đã giành quyền lực trong một cuộc đảo chính quân sự. Ðáp lại, người dân Gwangju yêu cầu dân chủ và phản kháng mãnh liệt. Lo rằng các cuộc biểu tình sẽ lan khắp Hàn quốc các quan chức quân đội bao gồm Chun Doo Hwan đã triệu tập binh lính và kết quả là nhiều người đã hy sinh. Chun Doo Hwan đã đắc cử tổng thống sau phong trào dân chủ hóa Gwangju ngày 18.5 . 
Ông phấn đấu để duy trì trật tự xã hội qua các chính sách nghiêm ngặt. Trong khi đó, yêu cầu về dân chủ không được đáp lại. các cuộc biểu tình diễn ra khắp đất nước khi chính phủ Chun Doo hwan phớt lờ các yêu cầu của người dân về một cơ chế bầu cử tổng thống trực tiếp năm 1987. Cuối cùng, chính phủ chấp thuận theo ý muốn của nhân dân và phục hồi cơ chế bầu cử tổng thống trực tiếp. 
Nền dân chủ dần dần phát triển và tiến bộ ở Hàn quốc sau khi sửa đổi hiến pháp năm 1987. Chính trị do quân đội lãnh đạo đã kết thúc năm 1993 khi Kim Young Sam được bầu làm tổng thống , ngoài ra lần đầu tiên trong lịch sử một ứng viên từ đảng đối lập, Kim Dae Jung đã đắc cử tổng thống trong cuộc bầu cử tổng thống năm 1997 và ông hoàn tất một cuộc chuyển giao quyền lực hòa bình. Việc thay đổi chính phủ diễn ra một lần nữa khi Lee Myung Bak một ứng viên từ đảng đối lập đắc cử vào năm 2007. Hàn quốc trở nên vững vàng và ổn định hơn như một nhà nước dân chủ qua quá trình như thế.","Amid confusion after the October 26 incident, military figures such as Chun Doo Han and Roh Tae woo seized power in a military coup. In response, the people of Gwangju demanded democracy and fierce opposition. Worried that the protests would spread across South Korea military officials including Chun Doo Hwan had summoned soldiers and as a result many died. Chun Doo Hwan was elected president after the Gwangju democratization movement on May 18.
He strives to maintain social order through strict policies. Meanwhile, the demand for democracy was not met. Protests took place all over the country when the Chun Doo Hwan government ignored people's requests for a direct presidential election mechanism in 1987. Finally, the government agreed to the will of the people and reinstate direct presidential election mechanism.
Democracy gradually developed and advanced in Korea after the constitutional amendment in 1987. Military-led politics ended in 1993 when Kim Young Sam was elected president, in addition to being the first in History of a candidate from the opposition party, Kim Dae Jung was elected president in the 1997 presidential election and he completed a peaceful transfer of power. The government change took place once again when Lee Myung Bak was a candidate from the opposition party who was elected in 2007. Korea became more stable and stable as a democratic state through such a process."
선거에 참여할 수 있는 나이가 낮아지고 있다.,"민주주의의 발전 과정에서 선거권을 가진 사람들의 수는 계속 늘어났다. 한국에서는 1948년 처음 근대적 선거를 도입하면서 선거권 연령을 만 21세로 정했다. 이후 1960년에는 만 20세로, 2005년에는 만 19세로 낮추었다. 최근에는 참정권을 더욱 확대하기 위해 선거권 연령을 만 18세나 그 이하로 낮추어야 한다는 주장도 제기되었다. | 하지만 만 18세 이하의 청소년에게 선거권을 부여하는 것은 너무 빠르다는 반대 의견도 있다.",Độ tuổi tham gia cuộc bầu cử ngày càng thấp.,The age to participate in the election is getting lower.,"Khi nền dân chủ tiến bộ ở hàn quốc, số người có quyền bầu cử gia tăng. Cơ chế bầu cử hiện đại được thiết lập ở hàn quốc. Năm 1948 cơ chế bầu cử hiện đại được đưa ra , tuổi bầu cử là 21 tuổi trở lên. Năm 1960 tuổi bầu cử là 20 trở lên. Năm 2005 tuổi bầu cử là 19 tuổi trờ lên. Gần đây một số người đã tuyên bố tuổi bầu cử nên giảm xuống còn 18 tuổi hoặc thậm chí trẻ hơn để mở rộng quyền chính trị của người hàn. Tuy nhiên, những người khác phản đối ý kiến này, khăng khăng rằng thanh niên 18 tuổi hoặc trẻ hơn còn quá trẻ để có quyền bầu cử. ","As democracy progresses in Korea, the number of people with voting rights increases. Modern electoral mechanisms are set up in Korea. In 1948 a modern electoral mechanism was introduced, voting age 21 and older. In 1960 the voting age was 20 or older. In 2005, the voting age is 19 years old and above. Recently, some people have stated that voting age should be reduced to 18 or even younger to expand Korean political rights. Others, however, oppose this idea, insisting that young people 18 years or younger are too young to have the right to vote."