Name,Script,name_vi,name_en,script_vi,script_en
"세계 속의 정보 강국, 대한민국","1990년대 중반 이후 한국은 빠르게 정보화 사회로 성장하였다. 과학기술 의 발전 속에서 컴퓨터, 통신 분야가 급속하게 성장하면서 국가경쟁력을 갖추어 나갔다. 그 결과 한국의 과학 경쟁력은 세계 6위, 기술경쟁력은 세계 13위로 정보 강국으로서의 면모를 갖추게 되었다(2015년 기준).
오늘날 반도체, 휴대폰, 디지털TV 등 정보통신기술(ICT) 관련 산업은 대한민국 산업을 이끌어가는 핵심 분야로 성장하였고, 전체 산업 수출 중 약 30%의 비중을 차지하는 등 우리나라 수출에 크게 기여하고 있다(2014년 기준). 신호등을 제어해 교통체증을 해소하는 교통정보 시스템, 교통카드를 활용해 버스나 전철을 이용하는 교통결제 시스템, 범죄 신고를 일괄적으로 처리하는 범죄 신고 전화 시스템과 같은 정보통신기술을 전 세계로 수출하고 있다.
한국은 특히 스마트폰, 인터넷 등의 분야에서 높은 국가경쟁력을 가지고 있다. 한국 제조사가 만든 스마트폰은 세계 시장에서 34%의 점유율을 차지하여 1위를 기록하고 있다(2014년 기준), 한국의 초고속인터넷 품질과 무선인터넷속도는 세계 1위(2012년 기준), 스마트폰 보급률은 세계 2위로(2013년 기준), 언제 어디서든 인터넷에 접속해 필요한 자료를 검색하고, 다른 사람과 소통할 수 있게 되었다. 한국의 전자정부 서비스는 UN 전자정부평가에서 세계 1위를 차지하여 세계 각국의 벤치마킹 대상이 되고 있다. 한국의 전자정부 서비스를 통해 가족관계증명서와 같은 각종 증명서 발급이나 민원 신청 등을 집 안에서 손쉽게 할 수도 있다.","Hàn quốc, cường quốc công nghệ thông tin của thế giới","Korea, the world's information technology power","Kể từ giữa những năm 1990, Hàn Quốc đã nhanh chóng phát triển thành một xã hội thông tin. Với sự phát triển của khoa học và công nghệ, lĩnh vực máy tính và truyền thông đã phát triển nhanh chóng và đạt được khả năng cạnh tranh quốc gia. Do đó, khả năng cạnh tranh khoa học của Hàn Quốc là thứ sáu trên thế giới và khả năng cạnh tranh công nghệ là thứ 13 trên thế giới, trở thành một cường quốc thông tin (tính đến năm 2015).

Ngày nay, các ngành công nghiệp liên quan đến công nghệ thông tin và truyền thông (CNTT) như bán dẫn, điện thoại di động và TV kỹ thuật số đã phát triển thành ngành chủ chốt dẫn đầu ngành công nghiệp Hàn Quốc, đóng góp đáng kể vào xuất khẩu của Hàn Quốc, chiếm khoảng 30% tổng xuất khẩu công nghiệp (2014) Tiêu chuẩn). Xuất khẩu công nghệ thông tin và truyền thông ra thế giới, chẳng hạn như hệ thống thông tin giao thông điều khiển đèn giao thông để loại bỏ ùn tắc giao thông, hệ thống thanh toán giao thông sử dụng xe buýt hoặc xe lửa sử dụng thẻ giao thông và hệ thống điện thoại báo cáo tội phạm xử lý chung các báo cáo tội phạm có.

Hàn Quốc có khả năng cạnh tranh quốc gia cao, đặc biệt là trong lĩnh vực điện thoại thông minh và Internet. Điện thoại thông minh do các nhà sản xuất Hàn Quốc sản xuất chiếm 34% thị trường thế giới, đứng đầu (tính đến 2014), chất lượng Internet tốc độ cao và tốc độ Internet không dây của Hàn Quốc đứng đầu thế giới (tính đến năm 2012), điện thoại thông minh Tỷ lệ thâm nhập là cao thứ hai trên thế giới (tính đến năm 2013), cho phép người dùng truy cập Internet, tìm kiếm các tài liệu cần thiết và liên lạc với những người khác. Dịch vụ chính phủ điện tử của Hàn Quốc là số 1 thế giới trong đánh giá chính phủ điện tử của Liên Hợp Quốc, làm cho nó trở thành một chuẩn mực cho các quốc gia trên thế giới. Thông qua dịch vụ chính phủ điện tử tại Hàn Quốc, cũng có thể dễ dàng cấp các loại chứng chỉ khác nhau, chẳng hạn như giấy chứng nhận quan hệ gia đình hoặc nộp đơn khiếu nại tại nhà.","Since the mid-1990s, Korea has rapidly grown into an information society. With the development of science and technology, the computer and communication fields have grown rapidly and have achieved national competitiveness. As a result, Korea's scientific competitiveness is the sixth in the world and the technological competitiveness is the 13th in the world, becoming an information powerhouse (as of 2015).
Today, information and communication technology (ICT)-related industries such as semiconductors, mobile phones, and digital TVs have grown into a key sector leading the Korean industry, contributing significantly to Korea's exports, accounting for about 30% of total industrial exports (2014 standard). Export information and communication technologies to the world, such as traffic information systems that control traffic lights to eliminate traffic jams, traffic payment systems that use buses or trains using transportation cards, and crime reporting telephone systems that collectively handle crime reports. have.
Korea has high national competitiveness, especially in the fields of smartphones and the Internet. Smartphones made by Korean manufacturers account for 34% of the world market, ranking first (as of 2014), Korea's high-speed Internet quality and wireless Internet speed ranked first in the world (as of 2012), smartphones The penetration rate is the second highest in the world (as of 2013), allowing users to access the Internet, search for necessary materials, and communicate with others. Korea's e-government service is the world's No. 1 in the United Nations e-government evaluation, making it a benchmark for countries around the world. Through the e-government service in Korea, it is also possible to easily issue various kinds of certificates, such as family relationship certificates, or apply for complaints, at home."
국제 사회와 협력하는 대한민국,"대한민국은 2009년 11월 경제 협력개발기구(OECD)의 개발 원조위원회(DAC)에 가입하는 등 원조공여국으로서 국제사회 에서 활발하게 활동하고 있다. 2014년을 기준으로 한국이 지원 하고 있는 공적개발원조(ODA) 는 약 18억 달러에 달한다. 공적개발원조는 현금 지원, 물자 지원, 인프라 구축, 전문가 파견, 연수생 초청 등 다양한 방식으로 이루어진다. 지리적으로 가까운 아시아의 여러 나라에 대한 지원이 가장 많으며, 분야별로는 보건의료, 교육, 정보통신 등에서 활발하게 지원이 이루어지고 있다.
세네갈의 마을에 우물을 파고 식수를 공급하는 수도관을 설치한 사업, 시리아 내전 으로 인해 가족과 집을 잃고 떠도는 난민이 머물 컨테이너 집을 짓고 아이들을 위한 태권도 교실을 운영하는 사업, 모로코의 청소년에게 자동차 기술을 가르쳐 취업을 돕고 여성의 사회진출을 돕는 사업, 네팔의 교사를 대상으로 특수교사 연수를 실시 하는 사업 등이 공적개발원조의 다양한 모습이다.
2004년부터는 기존의 방식 외에도 경제발전 경험 공유사업(KSP)을 통해 한국의 경제개발 노하우를 공유 하는 것을 통해 국제사회의 발전에 기여하고 있다.",Sự hợp tác của hàn quốc với cộng đồng quốc tế,South Korea working with the international community,"Hàn Quốc đang hoạt động trong cộng đồng quốc tế với tư cách là một quốc gia tài trợ, bao gồm cả việc tham gia Ủy ban hỗ trợ phát triển (DAC) của Tổ chức Hợp tác và Phát triển Kinh tế (OECD) vào tháng 11 năm 2009. Tính đến năm 2014, hỗ trợ phát triển chính thức (ODA) của Hàn Quốc lên tới khoảng 1,8 tỷ đô la. Hỗ trợ phát triển công cộng được cung cấp theo nhiều cách khác nhau, bao gồm hỗ trợ tiền mặt, hỗ trợ vật chất, xây dựng cơ sở hạ tầng, điều động các chuyên gia và lời mời của các học viên. Hỗ trợ chặt chẽ về mặt địa lý được cung cấp cho nhiều quốc gia ở châu Á và theo ngành, chăm sóc sức khỏe, giáo dục, thông tin và truyền thông đang được tích cực hỗ trợ.
Công việc lắp đặt ống nước để đào giếng và cung cấp nước uống ở các làng của Senegal, xây dựng nhà container cho các gia đình và người tị nạn đã mất gia đình và nhà cửa do Nội chiến Syria và điều hành các lớp học Taekwondo cho trẻ em, dạy công nghệ xe hơi cho thanh thiếu niên Ma-rốc và nhiều khía cạnh khác nhau của hỗ trợ phát triển công cộng, chẳng hạn như giúp tìm việc làm và giúp phụ nữ tiến vào xã hội, và thực hiện đào tạo giáo viên đặc biệt cho giáo viên Nepal.
Từ năm 2004, Hàn Quốc đã góp phần vào sự phát triển của cộng đồng quốc tế bằng cách chia sẻ bí quyết phát triển kinh tế của Hàn Quốc thông qua Dự án chia sẻ kinh nghiệm phát triển kinh tế (KSP) bên cạnh các phương pháp hiện có.","The Republic of Korea is active in the international community as a donor country, including joining the Development Assistance Committee (DAC) of the Organization for Economic Cooperation and Development (OECD) in November 2009. As of 2014, Korea's official development assistance (ODA) support amounted to approximately $1.8 billion. Public development assistance is provided in a variety of ways, including cash aid, material support, infrastructure construction, dispatching experts, and inviting trainees. Geographically close support is provided to many countries in Asia, and by sector, health care, education, and information and communication are actively being supported.
A business that installed water pipes to dig wells and supply drinking water to Senegal's villages, build a container home for families and refugees who have lost their families and homes due to the Syrian Civil War, and run a Taekwondo class for children, and teach Moroccan youth car technology There are various aspects of public development assistance, such as helping to find employment and helping women advance into society, and conducting special teacher training for teachers in Nepal.
Since 2004, Korea has contributed to the development of the international community by sharing Korea's economic development know-how through the Economic Development Experience Sharing Project (KSP) in addition to the existing methods."